IE;CNPJ;RAZAO;SIT;ARRECADACAO;ENTRADAS;SAIDAS;REGIME;SEGM;MUNICIPIO;DRR;DATA-IE;CONTADOR
"074345290";"28941651000103";"L FERNANDO DA SILVA ALVES ME";"C";;302.170,00;;"NORMAL";"SUPERMERCADOS";"LAGOA DOS GATOS";"II";26/10/2017;
"074339648";"28931758000162";"S. SILVA COMERCIO VAREJISTA DE ALIMENTOS LTDA ME";"C";16.569,12;1.984.775,48;2.051.029,69;"SIMPLES NACIONAL";"SUPERMERCADOS";"ITAMBE";"I";25/10/2017;"JOSE ANTONIO BARBOSA JUNIOR"
"074339052";"28931555000176";"JOSE M BARBOSA ME";"S";150,00;1.282.105,19;3.294.673,54;"NORMAL";"TECIDOS";"TAQUARITINGA DO NORTE";"II";25/10/2017;
"074338838";"28931544000196";"ELISA M DA SILVA ME";"C";10.416,08;504.508,90;;"SIMPLES NACIONAL";"TECIDOS";"SANTA CRUZ DO CAPIBARIBE";"II";25/10/2017;
"074338676";"28670950000223";"ADAM FELIPE DA SILVA ALVES";"S";;5.100,00;51.682,00;"NORMAL";"TECIDOS";"BREJO DA MADRE DE DEUS";"II";25/10/2017;
"074338595";"27174665000330";"VANESSA BATISTA DE SALES";"S";;;;"NORMAL";"TECIDOS";"VERTENTES";"II";25/10/2017;
"074331906";"28925406000102";"JULIANA MARIA DE LIMA ARMAZEM ME";"C";;;784.754,95;"NORMAL";"MATERIAL DE CONSTRUCAO";"ILHA DE ITAMARACA";"I";24/10/2017;
"074326902";"28910274000137";"JOSE ANTONIO NASCIMENTO SILVA 08534248451";"C";1,07;30.720,00;;"NORMAL";"SUPERMERCADOS";"PETROLINA";"III";23/10/2017;
"074289950";"28887445000154";"JOAO TORQUATO DE SOUZA NETO 05738324471";"C";;253.406,75;;"NORMAL";"TECIDOS";"SURUBIM";"II";23/10/2017;
"074283162";"28884549000105";"NATALIA GOMES DA SILVA 13450648454";"A";1.080,97;147.383,42;;"SIMEI";"ATACADO DE ALIMENTOS";"JABOATAO DOS GUARARAPES";"I";23/10/2017;
"074250230";"15168092000190";"STEMBERG FERNANDES DE ASSIS LIMA 02682660428";"A";;100.708,32;;"SIMEI";"ATACADO DE ALIMENTOS";"OLINDA";"I";23/10/2017;
"074239937";"28915704000103";"IRAIDEMBERG DOS SANTOS";"C";8.227,62;267.240,18;32.412,00;"SIMPLES NACIONAL";"TECIDOS";"SANTA CRUZ DO CAPIBARIBE";"II";23/10/2017;"JOSIEL AUGUSTO DA SILVA"
"074239341";"28914469000155";"A F AMORIM DE ALMEIDA FILHO ME";"C";;174.773,19;2.524.659,99;"NORMAL";"BEBIDAS";"POMBOS";"II";23/10/2017;
"074237136";"28902825000110";"JATOBA COMERCIAL DE ALIMENTOS EIRELI EPP";"C";;439.222,86;82.709,29;"NORMAL";"ATACADO DE ALIMENTOS";"OLINDA";"I";20/10/2017;"EDSON FERREIRA FILHO"
"074231448";"28891221000116";"CILENE GOME DA SILVA EIRELI ME";"C";9.796,64;278.976,00;;"NORMAL";"ATACADO DE ALIMENTOS";"RECIFE";"I";19/10/2017;
"074205951";"28843752000133";"MARIA DO CARMO DA SILVA 35570253491";"A";7,00;157.097,59;;"SIMEI";"VAREJO";"AGRESTINA";"II";18/10/2017;"AMARO CLOVIS DE MENEZES"
"074196944";"28838711000159";"ERICA MENDES DE OLIVEIRA 33972806809";"A";6,98;236.500,00;;"SIMEI";"INDUSTRIA DE ALIMENTOS";"OLINDA";"I";18/10/2017;
"074190318";"28834285000185";"ADRIANO FARIAS DAS NEVES 12945814498";"C";150,00;38.249,98;143.592,60;"NORMAL";"TECIDOS";"BREJO DA MADRE DE DEUS";"II";18/10/2017;
"074190237";"28834192000150";"ALISON ALEXANDRE SOARES 08881667452";"C";;204.049,59;12.100,00;"NORMAL";"TECIDOS";"BREJO DA MADRE DE DEUS";"II";18/10/2017;
"074188097";"28832527000100";"ELIELTON VASCONCELOS DA SILVA 71305476425";"C";;376.527,00;;"SIMEI";"TECIDOS";"BREJO DA MADRE DE DEUS";"II";18/10/2017;
"074162101";"28881683000152";"FEIGUANG ZHAN TEXTIL ME";"A";10.117,35;237.541,48;11.541,60;"SIMPLES NACIONAL";"TECIDOS";"CARUARU";"II";18/10/2017;"JOSE CARLOS TABOSA DO NASCIMENTO"
"074161644";"28881212000144";"ANDRE STEWART DA SILVA LIMA ME";"S";;100.532,18;410.008,00;"SIMPLES NACIONAL";"TECIDOS";"CARUARU";"II";18/10/2017;
"074161059";"09523756000190";"SIENA ATACADISTA DE MOVEIS LTDA";"C";41.351,98;335.955,87;;"NORMAL";"TECIDOS";"RECIFE";"I";18/10/2017;"CARLOS AFONSO ZAIDAN FILHO"
"074159666";"28874719000170";"NEIVA COMERCIAL EIRELI EPP";"C";;1.437.843,65;;"NORMAL";"INDUSTRIA DE ALIMENTOS";"PEDRA";"II";17/10/2017;"SANDRA APARECIDA SOARES DA SILVA"
"074154354";"28861049000158";"R MIKAELA FERREIRA ME";"C";1.578,00;398.715,00;;"NORMAL";"SUPERMERCADOS";"CACHOEIRINHA";"II";16/10/2017;
"074151258";"28858208000165";"COMERCIAL IRMAOS ARRUDA EIRELI ME";"C";;1.613.100,00;155.453,06;"NORMAL";"INDUSTRIA DE ALIMENTOS";"SAO BENEDITO DO SUL";"I";16/10/2017;
"074150952";"17418649000553";"GIALISON PEREIRA DOS SANTOS";"S";;1.443.600,95;;"NORMAL";"TECIDOS";"BREJO DA MADRE DE DEUS";"II";16/10/2017;
"074150448";"28856365000131";"COMERCIAL JENNIFFER DE ALIMENTOS EIRELI ME";"C";;1.798.987,00;1.526.281,30;"NORMAL";"ATACADO DE ALIMENTOS";"JABOATAO DOS GUARARAPES";"I";16/10/2017;
"074150286";"27156601000578";"ANA CLAUDIA SILVA TECIDOS";"S";;1.154.143,25;;"NORMAL";"TECIDOS";"BREJO DA MADRE DE DEUS";"II";13/10/2017;
"074148893";"28850627000150";"COMERCIAL BOA SERRA LTDA ME";"C";;235.690,00;;"NORMAL";"SUPERMERCADOS";"ILHA DE ITAMARACA";"I";13/10/2017;
"074146335";"28850012000124";"COMERCIAL SANTO AGOSTINHO EIRELI ME";"C";;244.910,00;;"NORMAL";"SUPERMERCADOS";"ILHA DE ITAMARACA";"I";13/10/2017;
"074141708";"28840828000177";"LUANA PATRICIA DOS S SILVA ME";"S";31,24;424.643,45;939.989,10;"NORMAL";"TECIDOS";"SURUBIM";"II";11/10/2017;
"074141376";"28840401000179";"JENNIFFER MARIA COELHO MACHADO ALIMENTOS ME";"C";;1.644.775,00;;"NORMAL";"ATACADO DE ALIMENTOS";"JABOATAO DOS GUARARAPES";"I";11/10/2017;
"074138669";"28816804000182";"DAVID BERNARDINO DE OLIVEIRA 70337228426";"C";;;420.808,94;"SIMEI";"TECIDOS";"TAQUARITINGA DO NORTE";"II";10/10/2017;
"074130765";"28811902000127";"LINDOMAR DA SILVA 60188871420";"C";;186.385,00;;"NORMAL";"INDUSTRIA DE ALIMENTOS";"ITAMBE";"I";10/10/2017;
"074106970";"28795577000156";"EVALDO ALEX SILVA DA FONSECA 14238406400";"C";;319.541,08;850.604,00;"NORMAL";"TECIDOS";"TORITAMA";"II";10/10/2017;
"074106708";"28795465000103";"JOSEFA DIAS DA SILVA 03327473447";"C";;74.016,60;406.534,38;"NORMAL";"TECIDOS";"TORITAMA";"II";10/10/2017;
"074099744";"28790800000172";"SANDRO ALEX DOS ANJOS 07161070406";"C";;24.990,00;1.224.615,43;"NORMAL";"TECIDOS";"TACAIMBO";"II";10/10/2017;
"074099400";"28790649000172";"WILLIAMS VASCONCELOS DA LUZ 03942454408";"A";;;681.366,09;"SIMEI";"TECIDOS";"CAMARAGIBE";"I";10/10/2017;
"074081888";"28779887000187";"PALOMA MARIA DA SILVA LIMA 09930867481";"A";2.678,58;90.303,76;;"SIMEI";"TECIDOS";"RECIFE";"I";10/10/2017;
"074060538";"28833656000104";"ANDERSON LUIS BEZERRA SUPRIMENTOS DE INFORMATICA";"C";;;485.000,00;"NORMAL";"VAREJO";"RECIFE";"I";10/10/2017;
"074054309";"28821720000137";"J N SILVA PLASTICOS EPP";"C";;107.990,00;270.953,39;"NORMAL";"INDUSTRIA";"CAMUTANGA";"I";09/10/2017;"VERA LUCIA REVOREDO PASSOS"
"074027085";"28764832000101";"JUESTO CEZARIO DE SOUZA 11518401490";"A";;195.925,10;;"SIMEI";"INDUSTRIA DE ALIMENTOS";"IPUBI";"III";02/10/2017;
"074007050";"28750968000154";"APARECIDA EVANGELISTA DA COSTA MESQUITA 05448376819";"B";;903.451,70;;"SIMEI";"BEBIDAS";"MARAVILHA";"I";02/10/2017;
"074006401";"28750622000156";"ALISON LOPES DE SOUSA 60670230324";"B";;612.515,30;;"SIMEI";"BEBIDAS";"CHA PRETA";"I";02/10/2017;
"073976660";"28734908000148";"WILLE ARAUJO SILVA 04701061409";"A";;814.207,91;;"SIMEI";"INDUSTRIA";"RECIFE";"I";02/10/2017;
"073974293";"28733133000196";"DEIVITY ALVES DA SILVA 11306616441";"C";450,00;914.119,35;4.095.137,56;"NORMAL";"VAREJO";"BREJO DA MADRE DE DEUS";"II";02/10/2017;
"073969451";"28717538000130";"LINDBERG CARLOS DE ALMEIDA NASCIMENTO 04457671460";"B";7,15;226.804,61;;"NORMAL";"VAREJO";"CARPINA";"I";02/10/2017;
"073939463";"28768761000107";"COMERCIAL MARES DO SUL EIRELI ME";"C";1.436,80;267.202,01;114.450,00;"NORMAL";"INDUSTRIA DE ALIMENTOS";"CACHOEIRINHA";"II";02/10/2017;"ANTONIO JOSE LOPES"
"073937681";"28760058000152";"SAO LONGUINHO COMERCIO E  EMPACOTAMENTO  LTDA ME";"C";4.734,00;101.700,00;;"NORMAL";"ATACADO DE ALIMENTOS";"BEZERROS";"II";29/09/2017;
"073936367";"27174665000259";"VANESSA BATISTA DE SALES";"C";;2.698.000,55;2.338.254,26;"NORMAL";"TECIDOS";"BREJO DA MADRE DE DEUS";"II";29/09/2017;
"073936286";"27744825000509";"JOSE ALAN DA SILVA VAREJISTA DE TECIDOS EPP";"C";;;213.904,30;"NORMAL";"TECIDOS";"BREJO DA MADRE DE DEUS";"II";29/09/2017;
"073929077";"28748518000127";"PEDRO BERNADINO DE SOUZA EIRELI ME";"C";310,56;140.000,00;;"SIMPLES NACIONAL";"BEBIDAS";"ITAMBE";"I";28/09/2017;"JOSE ANTONIO BARBOSA JUNIOR"
"073928348";"28746275000198";"DISTRIBUIDORA TRUMBO COMERCIO EIRELI ME";"C";;12.665,45;3.585.386,12;"NORMAL";"INDUSTRIA DE ALIMENTOS";"CORRENTES";"II";28/09/2017;
"073926990";"28741776000181";"MARIANA MIRANDA SAMPAIO ME";"C";;608.556,00;;"NORMAL";"SUPERMERCADOS";"PARNAMIRIM";"III";27/09/2017;
"073920363";"28727178000158";"F.B DA SILVA COMERCIO ME";"C";;35.594,00;2.910.101,36;"NORMAL";"INDUSTRIA DE ALIMENTOS";"ITAMBE";"I";26/09/2017;
"073919519";"28725895000140";"LAIANE PEREIRA DE SOUSA ME";"C";1.930,50;705.990,00;2.047.895,00;"NORMAL";"SUPERMERCADOS";"IPUBI";"III";26/09/2017;
"073918547";"28713620000197";"OZEIAS GALVAO DA SILVA NETO 10150721439";"B";;170.288,82;;"NORMAL";"TECIDOS";"TORITAMA";"II";25/09/2017;
"073897108";"28700246000195";"LUIZ HENRIQUE PEREIRA BISPO 09026389477";"A";;;791.356,40;"SIMEI";"TECIDOS";"CAMARAGIBE";"I";25/09/2017;
"073891592";"28538782000136";"MARIA DO CARMO SANTANA FERREIRA 50188798404";"B";9,22;77.203,83;516.197,75;"NORMAL";"INDUSTRIA";"JABOATAO DOS GUARARAPES";"I";25/09/2017;
"073883492";"28691328000110";"JOSE ERNANDO DA SILVA CHAGAS 72851384449";"A";;407.383,95;;"SIMEI";"TECIDOS";"SANTA CRUZ DO CAPIBARIBE";"II";25/09/2017;
"073879460";"28689143000171";"LUCELIA LOPES DE MOURA ESPINDOLA 09352602420";"A";8,62;387.841,68;;"SIMEI";"VEICULOS";"SAO BENTO DO UNA";"II";25/09/2017;
"073859940";"28678391000117";"VALCIEL JOSE DOS SANTOS 11019046406";"C";;78.327,53;896.166,10;"NORMAL";"TECIDOS";"TORITAMA";"II";25/09/2017;
"073852180";"28672440000104";"SERGIO ALEXANDRE DA SILVA ROCHA 54577080478";"A";8,15;172.876,05;;"SIMEI";"VEICULOS";"OLINDA";"I";25/09/2017;
"073838004";"28662470000130";"JOSENI DE LIMA SOUSA 05594315462";"C";;137.906,25;389.895,24;"NORMAL";"TECIDOS";"SANTA CRUZ DO CAPIBARIBE";"II";25/09/2017;
"073835846";"28661339000158";"MARIA IVONETE MELO CABRAL 01306869307";"C";;355.779,95;;"NORMAL";"BEBIDAS";"INAJA";"II";25/09/2017;
"073823830";"28705792000119";"COMERCIAL BEST HOUSE LTDA ME";"C";;65.879,04;;"NORMAL";"INDUSTRIA DE ALIMENTOS";"CAMOCIM DE SAO FELIX";"II";22/09/2017;
"073820903";"27341301000216";"ALEX ARAUJO DE BARROS";"S";;668.400,20;748.589,50;"NORMAL";"TECIDOS";"VERTENTES";"II";22/09/2017;
"073820814";"27469467000212";"FABIANO BERTO DE SOUZA SILVA EPP";"S";;80.215,42;288.279,20;"NORMAL";"TECIDOS";"TAQUARITINGA DO NORTE";"II";22/09/2017;
"073820733";"28388463000353";"ANDRE FRANCISCO DA SILVA CONFECCOES";"S";;627.039,79;2.120.656,40;"NORMAL";"TECIDOS";"VERTENTES";"II";22/09/2017;
"073819484";"28698467000176";"DIEGO V RAMOS DA SILVA CONFECCOES ME";"C";300,00;311.518,15;276.963,50;"NORMAL";"TECIDOS";"BREJO DA MADRE DE DEUS";"II";21/09/2017;"JOBSON MYKAEL RODRIGUES BATISTA"
"073805343";"28656375000123";"CLOTILDE EUFLAUZINA DA SILVA 02077153431";"A";;116.054,17;;"SIMEI";"TECIDOS";"SANTA CRUZ DO CAPIBARIBE";"II";20/09/2017;
"073769363";"28634684000100";"JORGE CARNEIRO 48072117904";"A";;962.729,00;;"SIMEI";"SUPERMERCADOS";"PETROLINA";"III";20/09/2017;
"073762270";"28629385000170";"MARIA BETANIA DA SILVA 34999280434";"A";4.952,80;164.598,64;;"SIMEI";"VAREJO";"RECIFE";"I";20/09/2017;
"073759805";"28628307000150";"GLEIVSON WASHINGTON CAETANO DA SILVA 12532483466";"A";10.009,01;477.013,57;;"SIMEI";"TECIDOS";"RECIFE";"I";20/09/2017;
"073752550";"28624573000105";"JOAO VITOR DE OLIVEIRA MACIEL 12372378406";"A";;112.209,60;;"SIMEI";"TECIDOS";"SANTA CRUZ DO CAPIBARIBE";"II";20/09/2017;
"073752398";"28624556000178";"MARIA JOSE DA SILVA FRUTUOSO 11382695497";"A";;105.822,33;;"SIMEI";"TECIDOS";"SANTA CRUZ DO CAPIBARIBE";"II";20/09/2017;
"073752207";"28624548000121";"MARIA DE LOURDES BARBOSA ANDRADE 03239283409";"A";;86.054,56;;"SIMEI";"TECIDOS";"SANTA CRUZ DO CAPIBARIBE";"II";20/09/2017;
"073751669";"28624455000105";"ANTONIO LUCIO SOBRINHO 01241237832";"A";;344.784,88;;"SIMEI";"TECIDOS";"SANTA CRUZ DO CAPIBARIBE";"II";20/09/2017;
"073751154";"28624337000199";"JOAO APRIGIO MACIEL 33924465487";"C";;307.432,97;;"SIMEI";"TECIDOS";"SANTA CRUZ DO CAPIBARIBE";"II";20/09/2017;
"073747980";"28623538000171";"JOSIVANE ROSA ALVES 68473192400";"A";1,00;219.175,49;240.688,65;"SIMEI";"VAREJO";"JABOATAO DOS GUARARAPES";"I";20/09/2017;
"073747203";"28623441000169";"MARCONI SILVA RODRIGUES 51866773453";"C";;83.247,75;;"SIMEI";"TECIDOS";"SANTA CRUZ DO CAPIBARIBE";"II";20/09/2017;
"073742910";"28621575000140";"SUSAN CARLA DE BARROS ROCHA COMERCIO DE ALIMENTOS";"A";6,12;234.684,01;;"SIMPLES NACIONAL";"VAREJO";"RECIFE";"I";20/09/2017;"PAULO JEFFERSON FERREIRA DA SILVA"
"073719420";"28677574000118";"COMERCIAL SUPER MIX LTDA ME";"C";;306.576,70;758.744,39;"NORMAL";"INDUSTRIA DE ALIMENTOS";"BONITO";"II";19/09/2017;
"073715603";"26749063000210";"CLAUDIONOR MENDES DA SILVA";"S";;765.571,38;1.145.186,30;"NORMAL";"TECIDOS";"JATAUBA";"II";19/09/2017;
"073715514";"28670950000142";"ADAM FELIPE DA SILVA ALVES";"S";;500,00;112.330,15;"NORMAL";"TECIDOS";"TAQUARITINGA DO NORTE";"II";19/09/2017;
"073712922";"28664202000157";"COMERCIAL CATENDE DO SUL EIRELI ME";"C";;46.725,00;465.545,48;"NORMAL";"BEBIDAS";"AMARAJI";"I";19/09/2017;
"073710040";"28663403000130";"ANA L F DA SILVA TECIDOS ME";"C";25.351,48;1.719.843,02;;"NORMAL";"TECIDOS";"SANTA CRUZ DO CAPIBARIBE";"II";19/09/2017;
"073707686";"28662580000100";"COMERCIAL NOVO CONDADO EIRELI ME";"C";;296.482,00;1.520.706,10;"NORMAL";"BEBIDAS";"CATENDE";"I";19/09/2017;
"073705551";"27948738000301";"ANDRESA LUANA DO NASCIMENTO OLIVEIRA";"S";;1.119.397,79;166.142,15;"NORMAL";"TECIDOS";"BREJO DA MADRE DE DEUS";"II";15/09/2017;
"073704822";"28609706000174";"JOSEFA L G DE SOUSA ME";"C";;291.587,52;831.789,05;"SIMPLES NACIONAL";"TECIDOS";"TAQUARITINGA DO NORTE";"II";15/09/2017;
"073703931";"28638964000189";"MARIA DAS DORES DA SILVA COMERCIO ME";"C";;903.156,54;304.088,64;"NORMAL";"INDUSTRIA DE ALIMENTOS";"POMBOS";"II";15/09/2017;
"073702706";"28630070000142";"F BARBOSA DE FREITAS COMERCIO ME";"C";;874.691,40;;"NORMAL";"INDUSTRIA DE ALIMENTOS";"SAIRE";"II";15/09/2017;
"073701998";"28610799000157";"JONAS SAMPAIO ROCHA ME";"S";;989.348,78;;"NORMAL";"TECIDOS";"BREJO DA MADRE DE DEUS";"II";15/09/2017;
"073678058";"28592133000113";"ALINE MIQUELLE RAMOS DOS SANTOS 12096267480";"C";;;199.426,80;"NORMAL";"TECIDOS";"SANTA CRUZ DO CAPIBARIBE";"II";11/09/2017;
"073629006";"26725916000100";"PRIMAVERA COMERCIO DE FUMOS LTDA ME";"C";;923.943,15;780,00;"NORMAL";"CIGARROS";"RECIFE";"I";06/09/2017;"LUIZ ROGERIO MARTINS DA SILVA"
"073627658";"28588392000170";"IVANILSON DA S. SANTIAGO CONFECCOES ME";"S";;199.997,25;;"SIMPLES NACIONAL";"TECIDOS";"TORITAMA";"II";06/09/2017;
"073627577";"26228381000316";"ROBERTA SIMONE DO NASCIMENTO";"S";;124.948,96;1.767.986,51;"NORMAL";"TECIDOS";"VERTENTE DO LERIO";"II";06/09/2017;
"073627496";"27744825000410";"JOSE ALAN DA SILVA VAREJISTA DE TECIDOS EPP";"C";;35.760,41;829.201,00;"NORMAL";"TECIDOS";"VERTENTES";"II";06/09/2017;
"073621374";"28580111000133";"CRISTIANE DE SENA RAMOS ME";"C";;;287.082,20;"NORMAL";"INDUSTRIA";"GRAVATA";"II";05/09/2017;
"073621102";"28578804000191";"J R TAVARES DISTRIBUIDORA DE BEBIDAS EIRELI ME";"C";;347.083,99;;"NORMAL";"BEBIDAS";"BELO JARDIM";"II";05/09/2017;
"073576131";"28544164000107";"RENATA DOS SANTOS OLIVEIRA SILVA 11024956466";"C";;249.723,66;695.830,50;"NORMAL";"TECIDOS";"CARUARU";"II";04/09/2017;
"073517470";"28558516000175";"F M DE OLIVEIRA GELADOS ME";"C";302,67;529.136,36;;"NORMAL";"INDUSTRIA DE ALIMENTOS";"LAGOA DO CARRO";"I";01/09/2017;
"073516902";"27428877000134";"R N DA SILVA CORREA ME";"C";;132.144,64;423.795,20;"SIMPLES NACIONAL";"TECIDOS";"SURUBIM";"II";01/09/2017;
"073516740";"27427978000190";"FRANCISCO F DO NASCIMENTO ME";"C";;153.798,18;;"NORMAL";"TECIDOS";"SURUBIM";"II";01/09/2017;
"073514969";"11707044000172";"JORGE L L DO NASCIMENTO LTDA ME";"C";;;5.798.870,28;"NORMAL";"ATACADO";"RECIFE";"I";31/08/2017;
"073513806";"28548391000100";"M MESSIAS DA SILVA EIRELI EPP";"C";965,64;779.450,35;393.243,87;"NORMAL";"BEBIDAS";"RECIFE";"I";31/08/2017;
"073513644";"28548871000163";"CICERO MARCOS DIAS DE BRITO ME";"A";9.467,49;620.950,00;;"SIMPLES NACIONAL";"SUPERMERCADOS";"IPUBI";"III";31/08/2017;"RAIMUNDO ANDRADE NETO"
"073503410";"27797800000212";"ALEXANDRE GALDINO DA SILVA VAREJISTA DE TECIDOS EPP";"S";;34.913,67;731.603,05;"NORMAL";"TECIDOS";"TAQUARITINGA DO NORTE";"II";30/08/2017;
"073483125";"28465282000111";"MAURICIO JOSE DA SILVA 06264314412";"C";;597.621,00;518.754,50;"NORMAL";"TECIDOS";"TAQUARITINGA DO NORTE";"II";29/08/2017;
"073479012";"28462597000105";"JOSE CARLOS DE MATOS 07015352532";"C";;3.447.890,33;;"SIMPLES NACIONAL";"SUPERMERCADOS";"ABREU E LIMA";"I";29/08/2017;
"073464171";"28500561000179";"AMARO FABRICIO DA SILVA 11814790454";"A";6,15;126.901,15;;"SIMEI";"BEBIDAS";"BARREIROS";"I";29/08/2017;
"073434698";"28481614000151";"JAILSON RODRIGUES FERREIRA 06595959313";"A";;363.665,28;;"SIMEI";"BEBIDAS";"MOREILANDIA";"III";29/08/2017;
"073434264";"28481431000136";"MARIA JOSE FERREIRA DE CASTRO 53309383334";"C";;407.167,75;;"SIMEI";"BEBIDAS";"SERTANIA";"II";29/08/2017;
"073428370";"28478621000102";"SAMUEL SALES DA SILVA 07676240417";"C";;;401.191,06;"NORMAL";"TECIDOS";"IBIRAJUBA";"II";29/08/2017;
"073421790";"28474778000151";"SERGIO JOSE SOARES NUNES 66651387472";"A";9,00;9.805,00;142.192,32;"SIMEI";"VAREJO";"RECIFE";"I";29/08/2017;
"073414743";"28388463000272";"ANDRE FRANCISCO DA SILVA CONFECCOES";"C";;192.200,94;270.423,52;"NORMAL";"TECIDOS";"BREJO DA MADRE DE DEUS";"II";29/08/2017;
"073414662";"27156601000497";"ANA CLAUDIA SILVA TECIDOS";"S";;381.956,64;1.034.370,30;"NORMAL";"TECIDOS";"BREJO DA MADRE DE DEUS";"II";29/08/2017;
"073412708";"28525066000114";"CARLOS DIEGO LINS ME";"C";7.467,45;215.909,20;;"NORMAL";"SUPERMERCADOS";"PALMARES";"I";29/08/2017;
"073399175";"28377441000126";"SILVIA R DA SILVA EPP";"C";;315.850,00;;"NORMAL";"INDUSTRIA DE ALIMENTOS";"FLORES";"II";24/08/2017;
"073394297";"28472274000100";"LINDRACIL S DA SILVA ME";"C";;167.360,15;;"SIMPLES NACIONAL";"TECIDOS";"TAQUARITINGA DO NORTE";"II";23/08/2017;
"073391433";"28470328000190";"DANIELLA DA SILVA MEDINO COMERCIO EPP";"C";;;;"NORMAL";"BEBIDAS";"AGRESTINA";"II";22/08/2017;
"073387835";"28459772000105";"MARIA DAS GRACAS CLEMENTINO 03600052411";"A";5,34;124.055,80;;"SIMEI";"VAREJO";"PETROLINA";"III";21/08/2017;
"073331457";"28422880000103";"TERCIO FRANCISCO DA SILVA SOUZA 70508851424";"C";;4.994,40;779.277,60;"NORMAL";"TECIDOS";"SANTA CRUZ DO CAPIBARIBE";"II";21/08/2017;
"073325309";"26367624000135";"MANOEL FELIX DUARTE 07180049301";"A";;381.230,49;;"SIMEI";"BEBIDAS";"MORENO";"I";21/08/2017;
"073324671";"28417971000150";"JOAO RICARDO DOS SANTOS 00743377427";"A";;96.045,72;676.730,00;"SIMEI";"TECIDOS";"JABOATAO DOS GUARARAPES";"I";21/08/2017;
"073298220";"28443415000159";"RAFAEL VINICIUS SOARES DE ALBUQUERQUE COMERCIO EPP";"C";;2.232.758,52;1.758.922,74;"NORMAL";"BEBIDAS";"ITAMBE";"I";17/08/2017;
"073297097";"28443093000148";"PRATA COMERCIO DE ALIMENTOS EIRELI EPP";"C";1.006,15;868.877,05;757.988,50;"NORMAL";"ATACADO DE ALIMENTOS";"CAMOCIM DE SAO FELIX";"II";17/08/2017;"LUIZ ROGERIO MARTINS DA SILVA"
"073290327";"28397724000130";"L P DA SILVA GOMES ALIMENTOS ME";"C";;462.336,11;;"NORMAL";"SUPERMERCADOS";"INAJA";"II";16/08/2017;
"073286567";"28428521000163";"COMERCIAL ITAMARACA ALIMENTOS LTDA ME";"C";;771.918,22;;"NORMAL";"SUPERMERCADOS";"ILHA DE ITAMARACA";"I";16/08/2017;
"073286486";"28428507000160";"COMERCIAL MIRANDIBA ALIMENTOS EIRELI EPP";"C";;1.194.310,40;;"NORMAL";"SUPERMERCADOS";"MIRANDIBA";"II";16/08/2017;
"073262625";"28393020000199";"ERIVALDO VICENTE DA SILVA 10508405424";"A";;218.341,50;;"SIMEI";"VAREJO";"RECIFE";"I";15/08/2017;
"073256811";"28388751000146";"LUAN FILIPE DE SOUTO 11330506464";"C";;632.232,14;635.316,00;"NORMAL";"TECIDOS";"SURUBIM";"II";15/08/2017;
"073221864";"28362899000101";"CARLOS EDUARDO DA SILVA PEREIRA 70270922474";"A";9,22;212.998,88;;"SIMEI";"ATACADO DE ALIMENTOS";"OLINDA";"I";15/08/2017;
"073218308";"28361569000100";"ERNANI FERREIRA DA SILVA 01293368407";"A";2.759,57;344.373,04;;"SIMEI";"ATACADO DE ALIMENTOS";"JABOATAO DOS GUARARAPES";"I";15/08/2017;
"073212792";"21786610000132";"JORGE TADEU ALVES FIGUEIROA FILHO 05628721409";"A";2.377,86;517.808,02;;"SIMEI";"INDUSTRIA DE ALIMENTOS";"RECIFE";"I";15/08/2017;"JOSE SOSTENES SILVA CRUZ"
"073203530";"28352429000167";"TIAGO CANDIDO DA SILVA 71502466481";"C";300,00;422.276,78;1.070.359,63;"NORMAL";"TECIDOS";"TAQUARITINGA DO NORTE";"II";15/08/2017;
"073201162";"28388463000191";"ANDRE FRANCISCO DA SILVA CONFECCOES";"S";;337.992,92;;"NORMAL";"TECIDOS";"TORITAMA";"II";15/08/2017;
"073200948";"27744825000339";"JOSE ALAN DA SILVA VAREJISTA DE TECIDOS EPP";"C";;;580.591,40;"NORMAL";"TECIDOS";"TAQUARITINGA DO NORTE";"II";15/08/2017;
"073200867";"26104464000212";"JOSE EDUARDO DOS SANTOS SILVA VAREJISTA DE TECIDOS";"S";;428.953,02;655.059,59;"NORMAL";"TECIDOS";"BREJO DA MADRE DE DEUS";"II";15/08/2017;
"073196304";"26228381000235";"ROBERTA SIMONE DO NASCIMENTO";"C";150,00;1.407.292,34;2.708.596,22;"NORMAL";"TECIDOS";"JATAUBA";"II";14/08/2017;
"073195090";"28367815000122";"COMERCIAL VENTUROSA MERCADOS EIRELI EPP";"C";;1.178.933,70;;"NORMAL";"SUPERMERCADOS";"VENTUROSA";"II";14/08/2017;
"073192902";"27281478000436";"JURACI BEZERRA DE MELO";"S";;727.520,44;23.981,50;"NORMAL";"TECIDOS";"JATAUBA";"II";14/08/2017;
"073192821";"17418649000472";"GIALISON PEREIRA DOS SANTOS";"S";;724.870,66;108.966,95;"NORMAL";"TECIDOS";"BREJO DA MADRE DE DEUS";"II";14/08/2017;
"073181110";"28375883000133";"COMERCIAL MANDAU EIRELI EPP";"C";;1.405.511,60;420.500,00;"NORMAL";"INDUSTRIA DE ALIMENTOS";"RECIFE";"I";09/08/2017;
"073171310";"28349799000145";"BRUNO RAPHAEL GOMES DA SILVA 06539557400";"C";6.717,91;268.791,46;;"NORMAL";"VAREJO";"RECIFE";"I";07/08/2017;
"073154067";"28338378000119";"JOSE ELIAS SOUZA NETO 12686666617";"B";8,20;280.371,83;;"NORMAL";"TECIDOS";"IPUBI";"III";07/08/2017;
"073153680";"28338083000142";"JUCIANO LEITE DA SILVA 09307941416";"C";;143.283,60;150.720,00;"NORMAL";"TECIDOS";"SANTA CRUZ DO CAPIBARIBE";"II";07/08/2017;
"073130630";"28320606000123";"ANDSON JOSE DA SILVA 09487747460";"C";;202.165,61;907.298,30;"NORMAL";"TECIDOS";"BREJO DA MADRE DE DEUS";"II";07/08/2017;
"073097322";"28295866000196";"RAIMUNDO DOS SANTOS LOPES 43893740368";"S";;452.928,34;;"NORMAL";"INDUSTRIA DE ALIMENTOS";"SERTANIA";"II";07/08/2017;
"073096270";"28153055000150";"V.M.S. SERVICOS DE CABELEIREIROS LTDA ME";"C";;;;"SIMPLES NACIONAL";"VAREJO";"RECIFE";"I";07/08/2017;
"073091715";"28352368000138";"MERCANTIL VILA POPULAR EIRELI EPP";"C";160,70;2.005.069,20;527.071,44;"NORMAL";"ATACADO DE ALIMENTOS";"FLORES";"II";07/08/2017;"EDSON FERREIRA FILHO"
"073087874";"28346836000161";"J.H. MEDINO DA SILVA EPP";"C";;102.120,00;41.000,00;"NORMAL";"INDUSTRIA DE ALIMENTOS";"RECIFE";"I";07/08/2017;
"073085154";"28340485000181";"JOAO PEREIRA DISTRIBUIDORA EIRELI EPP";"C";;;1.466.598,32;"NORMAL";"INDUSTRIA DE ALIMENTOS";"MACHADOS";"I";04/08/2017;
"073078700";"28322796000118";"CASA MODA CONFECCOES LTDA ME";"S";13.154,88;192.130,12;;"SIMPLES NACIONAL";"TECIDOS";"RECIFE";"I";02/08/2017;"JESSE ONOFRE DE OLIVEIRA"
"073078450";"28322472000180";"COMERCIAL CARAUNA LTDA EPP";"C";;2.278.196,62;287.190,00;"NORMAL";"INDUSTRIA DE ALIMENTOS";"AFOGADOS DA INGAZEIRA";"II";02/08/2017;
"073077216";"28322237000108";"COMERCIAL JOSE ALBERTO LIMA LOURENCO EIRELI EPP";"C";;1.601.132,50;3.147.672,99;"NORMAL";"ATACADO";"POCAO";"II";02/08/2017;
"073077054";"28321866000113";"COMERCIAL FALESIAS LTDA EPP";"C";;3.608.089,10;4.114.931,01;"NORMAL";"INDUSTRIA DE ALIMENTOS";"RECIFE";"I";02/08/2017;
"073071790";"28306191000133";"ATACADO DAS MALHAS EIRELI ME";"S";;217.468,54;1.439.232,01;"NORMAL";"TECIDOS";"RECIFE";"I";01/08/2017;
"073070807";"28301960000100";"MARCELO FRANCISCO PEREIRA ME";"C";;563.533,53;5.575.645,81;"NORMAL";"BEBIDAS";"RIACHO DAS ALMAS";"II";01/08/2017;
"073070637";"27744825000258";"JOSE ALAN DA SILVA VAREJISTA DE TECIDOS EPP";"C";;73.377,50;674.021,55;"NORMAL";"TECIDOS";"FREI MIGUELINHO";"II";01/08/2017;
"073066958";"28294045000135";"THIAGO CALIXTO DA SILVA 10133858456";"A";10,88;198.458,67;;"SIMEI";"ATACADO DE ALIMENTOS";"RECIFE";"I";31/07/2017;
"073028789";"28268965000189";"CARLOS CESAR GOMES DA SILVA 07161635438";"C";72,40;161.836,39;237.487,40;"NORMAL";"TECIDOS";"SANTA CRUZ DO CAPIBARIBE";"II";31/07/2017;
"073027626";"21357745000182";"FRANCISCO GOMES DE SOUSA 27429962300";"C";220,80;396.387,24;;"NORMAL";"INDUSTRIA DE ALIMENTOS";"AGRESTINA";"II";31/07/2017;
"073019364";"28263417000166";"SAMARA CLEIA SILVA NASCIMENTO 06790416307";"C";;312.714,87;;"NORMAL";"BEBIDAS";"BELEM DE MARIA";"I";31/07/2017;
"073018392";"28262794000180";"REGINA CLAUDINO DA SILVA 99400464304";"C";;323.184,55;;"NORMAL";"BEBIDAS";"SAO JOSE DO BELMONTE";"III";31/07/2017;
"073017582";"28262393000120";"MARIA IZALENE GOMES DA SILVA 34413872878";"C";;395.107,93;;"NORMAL";"BEBIDAS";"CATENDE";"I";31/07/2017;
"073016691";"28262023000193";"CINTIA TEIXEIRA CAITANO 01547425385";"C";;505.640,87;;"NORMAL";"BEBIDAS";"VERDEJANTE";"III";31/07/2017;
"073008672";"28256404000160";"ALLISON MORAIS LINDOSO 04714477498";"A";1,06;173.800,00;;"SIMEI";"TECIDOS";"RECIFE";"I";31/07/2017;
"072992735";"28245804000170";"MACIEL DA SILVA MIRANDA 11645800431";"B";;578.949,97;;"SIMEI";"TECIDOS";"TORITAMA";"II";31/07/2017;
"072986760";"28289187000104";"PAULO NAZARE CAVALCANTI DE ALBUQUERQUE EPP";"S";;156.000,00;2.001.501,75;"NORMAL";"INDUSTRIA";"OLINDA";"I";31/07/2017;
"072982691";"28286666000177";"COMERCIO DE ALIMENTOS FREI DAMIAO LTDA ME";"C";;1.656.829,79;;"NORMAL";"SUPERMERCADOS";"ARARIPINA";"III";28/07/2017;
"072982268";"09413749000488";"FABIANO FERREIRA DA SILVA TECIDOS EPP";"S";;155.918,13;2.215.332,15;"NORMAL";"TECIDOS";"BREJO DA MADRE DE DEUS";"II";28/07/2017;
"072981105";"28281158000104";"M P DOS SANTOS PRODUTOS EM PAPEL ME";"S";12,00;954,50;2.201.606,39;"NORMAL";"INDUSTRIA";"RECIFE";"I";28/07/2017;
"072960965";"28237038000100";"CLARICE ROBELIA DA CONCEICAO 10363010440";"A";;103.435,89;;"SIMEI";"VAREJO";"CARUARU";"II";26/07/2017;
