IE;CNPJ;RAZAO;SIT;ARRECADACAO;ENTRADAS;SAIDAS;REGIME;SEGM;MUNICIPIO;DRR;DATA-IE;CONTADOR
"046839437";"04120719000540";"DALKA DO BRASIL LTDA";"C";70.505,86;349.442,80;957.616,71;"NORMAL";"INDUSTRIA";"PETROLINA";"III";07/12/2011;"WELLINGTON SANTOS LINS"
"046768742";"14510822000127";"SAMUEL ALVES DA ROCHA ME";"C";;40.480,00;;"NORMAL";"TECIDOS";"VERTENTES";"II";05/12/2011;"ODILON CAVALCANTI DE ALBUQUERQUE NETO"
"046621059";"14623686000181";"GILSON BATISTA DE OLIVEIRA 67056776434";"A";1,50;524.217,93;;"SIMEI";"VAREJO";"JABOATAO DOS GUARARAPES";"I";21/11/2011;
"046596275";"14610655000196";"ALEXANDRE CESAR MOTA FLORENCIO ME";"A";181.374,79;4.788.998,45;138.489,78;"SIMPLES NACIONAL";"TECIDOS";"CARUARU";"II";21/11/2011;"ROSANGELA MARTHA FERREIRA DE ALCANTARA"
"046594906";"14510819000103";"GEISON FERREIRA DE ANDRADE ME";"A";15.664,01;351.842,27;99.718,00;"SIMPLES NACIONAL";"TECIDOS";"VERTENTES";"II";21/11/2011;"ODILON CAVALCANTI DE ALBUQUERQUE NETO"
"046440267";"14547283000109";"JONAS DE ALMEIDA FERREIRA 07880567437";"C";;217.390,86;159.080,42;"NORMAL";"TECIDOS";"CARUARU";"II";07/11/2011;
"046402098";"14540104000101";"DIEGO CAVALCANTE DE ALBUQUERQUE 05611174469";"C";24,52;;;"NORMAL";"INDUSTRIA DE ALIMENTOS";"RECIFE";"I";31/10/2011;
"046374370";"14519891000100";"IVANILDO CIPRIANO GOMES 79373550420";"A";30,27;1.482.816,68;;"SIMEI";"INDUSTRIA DE ALIMENTOS";"JABOATAO DOS GUARARAPES";"I";31/10/2011;
"046257063";"14373345000103";"J. D. DE BARROS JUNIOR - PRODUTOS DE LIMPEZA";"C";;847.041,74;1.309.727,90;"NORMAL";"INDUSTRIA";"VITORIA DE SANTO ANTAO";"II";21/10/2011;"SALUSTIANO JOSE DA SILVA"
"046256091";"14459975000197";"OSMARINO PAZ DE LIRA ME";"S";93,98;48.518,31;;"NORMAL";"TECIDOS";"BELO JARDIM";"II";21/10/2011;"JOSEFA DILZA FERREIRA DOS SANTOS"
"046183353";"14432952000199";"CRISTINA MARIA SILVA DOS SANTOS 08830411469";"A";37,01;401.910,18;;"SIMEI";"ATACADO DE ALIMENTOS";"PAULISTA";"I";17/10/2011;"SEVERINO HENRIQUE GAMA"
"046174796";"14233262000372";"A. M. C. COMERCIO DE ARTIGOS DE VESTUARIOS EIRELI ME";"A";241,05;1.750,00;;"NORMAL";"TECIDOS";"CABO DE SANTO AGOSTINHO";"I";14/10/2011;"MURILO JOSE MARCIANO"
"046170103";"14435591000134";"D & E USINAGEM E CALDEIRARIA LTDA ME";"C";;207.530,21;974.791,92;"NORMAL";"INDUSTRIA";"SAO LOURENCO DA MATA";"I";14/10/2011;"MARCOS ANTONIO CANCIO BARBOSA"
"045999260";"14365090000129";"JOSINEIDE FERREIRA DA SILVA 61118540468";"B";28,05;203.309,68;;"NORMAL";"TECIDOS";"JABOATAO DOS GUARARAPES";"I";03/10/2011;
"045878633";"14335860000190";"ALINE RAYANE FELIX DA SILVA ME";"S";28.108,96;644.871,45;;"SIMPLES NACIONAL";"TECIDOS";"RECIFE";"I";26/09/2011;"WILSON PAIVA DO NASCIMENTO"
"045676682";"14217977000170";"EDJALMA SIQUEIRA DE LIMA ME";"S";3.727,19;92.149,22;1.550,00;"SIMPLES NACIONAL";"TECIDOS";"SANTA CRUZ DO CAPIBARIBE";"II";13/09/2011;"NECITON CLIMERIO DA SILVA"
"045579806";"08751352000271";"AMERICAN BLEND IMPORTACAO EXPORTACAO INDUSTRIA & COM. DE TABACOS LTDA";"S";;;;"CONTRIBUINTE SUBSTITUTO";"CIGARROS";"VISCONDE DO RIO BRANCO";"I";31/08/2011;
"045543968";"14180577000137";"ROSILDA LAURENTINO DA SILVA 00920077757";"A";28,26;285.403,46;;"SIMEI";"VAREJO";"CORTES";"I";29/08/2011;"MAYSA GALDINO DA SILVA"
"045447810";"14139842000133";"R DA S ROCHA COMERCIO DE VESTUARIO";"C";;3.897,58;;"NORMAL";"TECIDOS";"RECIFE";"I";23/08/2011;"DANIEL BATISTA BOMFIM"
"045401314";"12026054000105";"ROSANIA MARIA DE SOUSA ME";"A";1.552,97;16.177,20;;"SIMPLES NACIONAL";"TECIDOS";"FERNANDO DE NORONHA";"I";22/08/2011;"LUZINETE LIMA DA PURIFICACAO"
"045370508";"14116625000128";"B & L'S INDUSTRIA DE CONFECCOES LTDA ME";"S";;;;"NORMAL";"TECIDOS";"SURUBIM";"II";16/08/2011;
"045287279";"13253656000168";"ABEL TAVARES DE LIMA FILHO ME";"S";77,51;138.726,61;;"NORMAL";"TECIDOS";"TAQUARITINGA DO NORTE";"II";11/08/2011;"LENIVALDO GONCALVES LEANDRO"
"045280851";"14082704000165";"ANGELA MARIA SANTANA DE MACEDO ME";"S";2.476,50;77.933,00;;"SIMPLES NACIONAL";"TECIDOS";"CARUARU";"II";10/08/2011;"EDILSON BATISTA DE OLIVEIRA"
"045206708";"12320782000125";"ARTSEG - COMERCIO ATACADISTA DE EQUIPAMENTOS DE PROTECAO LTDA ME";"S";500,13;63.171,02;144.594,31;"NORMAL";"TECIDOS";"OLINDA";"I";08/08/2011;"VERA LUCIA DE SOUZA"
"045206619";"14076858000144";"MARCOS JOSE DE SOUZA SANTOS ME";"A";2.454,56;930.912,94;242.095,32;"SIMPLES NACIONAL";"TECIDOS";"TACARATU";"III";08/08/2011;"FRANCISCO DE ASSIS GOMES CARNEIRO"
"045205302";"14058970000152";"VERSAN GRAFICA COMERCIO EIRELI ME";"S";1.028,01;131.006,03;;"NORMAL";"TECIDOS";"PAULISTA";"I";08/08/2011;"MAGI RAMOS OLIVEIRA"
"045201900";"11972906000356";"INTERTEC INDUSTRIA COMERCIO E IMPORTACAO DE METAIS LTDA";"C";;;;"NORMAL";"INDUSTRIA";"ESCADA";"I";08/08/2011;
"045186081";"07661729000239";"ANNE RAFAELLA DE MELO SILVA COMERCIO DE VESTUARIO ME";"A";28.781,46;2.163.913,25;180.389,70;"SIMPLES NACIONAL";"TECIDOS";"RIACHO DAS ALMAS";"II";03/08/2011;"AUMERI TABOSA"
"045177686";"14036822000137";"WANDILENE ETELVINA FREITAS DE LIMA 51350491420";"A";26,04;649.097,60;;"SIMEI";"SUPERMERCADOS";"OLINDA";"I";01/08/2011;
"045115060";"14010743000157";"OLAVO GOMES CARVALHO JUNIOR 00970420480";"C";24,39;;;"NORMAL";"VAREJO";"PETROLINA";"III";01/08/2011;
"045098891";"14004025000178";"SEVERINO JACINTO DA COSTA 26647435468";"A";1.034,77;176.862,75;;"SIMEI";"VAREJO";"RECIFE";"I";01/08/2011;
"045082626";"11973537000235";"C A V COMERCIAL IMPORTACAO E EXPORTACAO LTDA";"S";;;;"NORMAL";"TECIDOS";"CARUARU";"II";01/08/2011;"JOAO CANDIDO DA COSTA FILHO"
"045066507";"13991367000166";"ISABELA MACHADO DIAS ANDRADE BARBOSA 04081280460";"C";;3.312,83;;"NORMAL";"TRANSPORTE";"RECIFE";"I";29/07/2011;
"044997272";"13996182000144";"JULIANA EMILIA DA SILVA ME";"A";115.953,65;2.508.344,91;154.246,90;"NORMAL";"TECIDOS";"CUPIRA";"II";29/07/2011;"MARIA SOLANIA DOS SANTOS MELO"
"044992718";"14002949000135";"ALEQUI SANDRA ALVES MARCELINO ME";"A";1.459,54;805.029,18;;"SIMEI";"ATACADO DE ALIMENTOS";"ARARIPINA";"III";28/07/2011;"MARIA MENDES DE SOUSA ALENCAR"
"044891601";"13961406000182";"ALVES & FAGUNDES CONFECCOES LTDA - ME";"C";35,18;177.549,99;;"NORMAL";"TECIDOS";"ABREU E LIMA";"I";21/07/2011;"ALDEM LUIZ DA SILVA"
"044874944";"97551146000167";"KALTECNICA SERVICOS INDUSTRIAIS EIRELI ME";"A";6.949,33;8.140.913,20;7.202.617,24;"SIMPLES NACIONAL";"INDUSTRIA";"IGARASSU";"I";19/07/2011;"DANIELLA INTERAMINENSE DE LIMA"
"044874006";"12416156000137";"LEO GAS LTDA";"A";1.543,75;30.700.936,43;21.419.218,95;"SIMPLES NACIONAL";"COMBUSTIVEL";"OLINDA";"I";19/07/2011;"CASSIA IRINEIA DE ANDRADE LINS"
"044867816";"07667367000102";"COPERSUL INDUSTRIA PRODUTORA DE ACUCAR, ETANOL E ENERGIA ELETRICA LTDA";"A";1.547.090,00;32.602.978,03;76.122.030,94;"NORMAL";"COMBUSTIVEL";"CORTES";"I";18/07/2011;"VALTERJOY DE OLIVEIRA LOBO"
"044769806";"12727145001573";"GUARAVES GUARABIRA AVES LTDA";"A";801.715,45;11.950.269,55;13.882.997,99;"NORMAL";"ATACADO DE ALIMENTOS";"RECIFE";"I";12/07/2011;"EGLYS HERMESON DE ALMEIDA OLIVEIRA"
"044750463";"13907876000168";"CANDIDO BEZERRA DA SILVA JUNIOR ARREIOS ME";"S";5.355,57;51.449,49;59.409,00;"SIMPLES NACIONAL";"VAREJO";"CACHOEIRINHA";"II";07/07/2011;"PAULO HENRIQUE SIQUEIRA"
"044654154";"13504560000125";"EDNA C DE ARAUJO-ME";"S";1.744,55;1.900,00;;"NORMAL";"TECIDOS";"RECIFE";"I";07/07/2011;"VALDIR MENDES DE OLIVEIRA"
"044576846";"13830267000158";"JOSIMERE MARIA AMERICA 47831600400";"S";;373.041,76;;"NORMAL";"VAREJO";"RECIFE";"I";27/06/2011;
"044419317";"13778858000123";"SAFIRA DISTRIBUIDORA DE ARTIGOS DESCARTAVEIS EIRELI";"S";;1.000,00;1.448.927,36;"NORMAL";"ATACADO";"JABOATAO DOS GUARARAPES";"I";13/06/2011;"SIMONE PEREIRA DA SILVA"
"044415320";"83754234013806";"DISTRIBUIDORA BIG BENN S A";"C";29.306.202,56;256.884.459,60;329.036.661,28;"NORMAL";"MEDICAMENTOS";"RECIFE";"I";10/06/2011;"ISABELLA QUEIROZ GUIMARAES"
"043967906";"13483484000119";"MMJ COMERCIO DE ARMARINHO LTDA ME";"S";2.154,70;172.099,51;;"NORMAL";"TECIDOS";"RECIFE";"I";29/04/2011;"CLODOMIR COUTINHO DE ALMEIDA"
"043889255";"13518148000164";"B E C MYLLYS INDUSTRIA E COMERCIO LTDA - ME";"C";6.021,68;88.099,29;209.106,77;"NORMAL";"TECIDOS";"JABOATAO DOS GUARARAPES";"I";25/04/2011;"CROMACIO RIBEIRO DE MORAES FILHO"
"043777880";"13433254000145";"JEITO MOLEQUE COMERCIO VAREJISTA DE VESTUARIO LTDA";"A";32.393,10;377.463,26;612.467,75;"NORMAL";"TECIDOS";"CARUARU";"II";12/04/2011;"VALDEMAR FERNANDES DA COSTA FILHO"
"043757502";"13274043000107";"C M DA SILVA - COMERCIO DE ARTIGOS DO VESTUARIO - ME";"A";66.742,22;913.570,52;;"SIMPLES NACIONAL";"TECIDOS";"RECIFE";"I";07/04/2011;"JOSE EDSON DA SILVA"
"043565786";"13339878000106";"AMOS ESTEVO DE LIMA 79310010444";"S";20.160,56;196.232,46;;"NORMAL";"VAREJO";"RECIFE";"I";15/03/2011;
"043532772";"13299960000146";"JOSE DE MACEDO CARVALHO 87647516353";"A";784,65;675.378,78;;"SIMEI";"COMBUSTIVEL";"ARARIPINA";"I";15/03/2011;
"043525482";"13292695000174";"REBEKA MACHADO LINS DA PAIXAO 06005814460";"A";0,95;200.318,06;;"SIMEI";"TECIDOS";"RECIFE";"I";15/03/2011;"WILLAMS ULISSES DE OLIVEIRA E SILVA"
"043246761";"00027986000274";"TRIFER INDUSTRIA METALURGICA LTDA";"C";;;;"NORMAL";"INDUSTRIA";"CABO DE SANTO AGOSTINHO";"I";10/02/2011;"JULIANA RIBEIRO BRANDAO"
"043220886";"19884626001299";"ORTENG EQUIPAMENTOS E SISTEMAS S.A.";"C";565,80;;6.306.703,28;"NORMAL";"INDUSTRIA";"IPOJUCA";"I";07/02/2011;"GERSON MOURA FONSECA"
"043164285";"13152565000136";"PEDRO LUIZ DA SILVA 87949741449";"A";502,00;91.800,00;;"SIMEI";"VAREJO";"RECIFE";"I";02/02/2011;
"043062601";"13097422000179";"CLEITON SANDRO DA SILVA VIEIRA 08805744450";"A";28,03;191.487,70;;"SIMEI";"MATERIAL DE CONSTRUCAO";"ABREU E LIMA";"I";26/01/2011;
"043029078";"09488817000125";"M F DE SOUZA EMBALAGENS ME";"C";3.156,00;1.377.185,47;757.322,44;"NORMAL";"ATACADO DE ALIMENTOS";"JABOATAO DOS GUARARAPES";"I";21/01/2011;"MAURICIO DUARTE DA SILVA"
"043025919";"13120190000122";"SIM SUPERMERCADOS LTDA ME";"C";3.110,61;5.592.012,04;34.270,42;"NORMAL";"SUPERMERCADOS";"SERTANIA";"II";21/01/2011;"JOSE LUCIANO DA COSTA GOIS"
"043018203";"11755987000170";"IMPACTO INDUSTRIA DE PAPEL E DISTRIBUIDORA DE CERAMICAS LTDA - ME";"C";;95.040,00;481.023,36;"NORMAL";"INDUSTRIA";"VITORIA DE SANTO ANTAO";"II";20/01/2011;"FERNANDO LUIZ DE ARAUJO BARBOSA"
"042957222";"13062283000148";"SAMUEL J REIS ME";"C";16,20;222.976,42;;"NORMAL";"VAREJO";"RECIFE";"I";13/01/2011;"JAIME JOSE BARBOSA RODRIGUES VIANA"
"042921970";"13051328000189";"USIBELT INDUSTRIA COMERCIO E SERVICOS EM METAL LTDA";"C";;37.708,62;3.611.165,57;"NORMAL";"INDUSTRIA";"RECIFE";"I";11/01/2011;"REGINALDO JOSE DE MEDEIROS"
"042809541";"13002742000106";"MERGULHAO AVICOLA LTDA";"A";1.666,47;6.601.940,66;618.605,90;"SIMPLES NACIONAL";"INDUSTRIA DE ALIMENTOS";"TACAIMBO";"II";23/12/2010;"CRISTIANO RODRIGUES DO NASCIMENTO"
"042808227";"13007957000101";"BLUE COMEX IMPORTACOES E EXPORTACOES EIRELI";"A";2.580,70;186.370,18;1.583.697,07;"NORMAL";"TECIDOS";"RECIFE";"I";23/12/2010;"IGOR CAMPOS BARROS"
"042665795";"08080267000229";"JOSEILSON GENESIO DA SILVA VESTUARIOS ME";"B";;;80.846,60;"NORMAL";"TECIDOS";"TORITAMA";"II";17/12/2010;
"042641853";"12822220000180";"ROBERTO MORAIS DE LIMA 07434545704";"A";;8.611,70;;"SIMEI";"VAREJO";"JABOATAO DOS GUARARAPES";"I";17/12/2010;
"042479061";"60736279002060";"MABE BRASIL ELETRODOMESTICOS LTDA";"C";;9.258,40;100.000,00;"NORMAL";"INDUSTRIA";"JABOATAO DOS GUARARAPES";"I";13/12/2010;"MARIA ELENICE PEREIRA DA CUNHA"
"042411505";"12902807000107";"JUANA LUIZA MOURA DE ARAUJO 00998667498";"A";1.132,93;75.008,43;;"SIMEI";"TECIDOS";"RECIFE";"I";08/12/2010;"VALERIA GOMES DE SOUSA LIRA"
"042351006";"12891783000120";"CALIXTO INDUSTRIA E COMERCIO DE FARDAMENTOS LTDA EPP";"C";22.408,00;903.560,71;1.567.856,76;"NORMAL";"TECIDOS";"OLINDA";"I";25/11/2010;"DIOGENES RAMOS BRASILEIRO"
"042342600";"08012433000250";"SOBRAL TECIDOS EIRELI";"A";191.764,83;993.956,64;6.973.920,09;"NORMAL";"TECIDOS";"TORITAMA";"II";24/11/2010;"ELISANGELA MEDEIROS DA SILVA"
"042313414";"12847001000155";"ANTONIO J FERREIRA ARAUJO ME";"S";86,43;117,60;;"NORMAL";"TECIDOS";"LAJEDO";"II";18/11/2010;"FABIO ANDRADE DE MELO"
"042031605";"12729138000105";"J M DE QUEIROZ E CIA VESTUARIO LTDA ME";"S";320,68;;1.108.696,91;"NORMAL";"TECIDOS";"CORTES";"I";09/11/2010;
"041967240";"12642598000100";"LUTECIA DINIZ NUNES 02702418414";"A";3.922,78;178.340,20;;"SIMEI";"TECIDOS";"PETROLINA";"III";06/11/2010;"REGINA BEZERRA OLIVEIRA GOMES"
"041963172";"12639776000135";"MAURA MARIA DOS SANTOS";"S";25,00;;;"SIMPLES NACIONAL";"VAREJO";"IPOJUCA";"I";06/11/2010;"JOSE VITALINO CAVALCANTI FILHO"
"041813103";"12607575000156";"M DE ASSIS TAVARES & CIA LTDA ME";"S";9.101,25;1.114.079,70;1.968.428,56;"NORMAL";"TECIDOS";"SANTA CRUZ DO CAPIBARIBE";"II";14/10/2010;"MARCELO DE ASSIS TAVARES"
"041706285";"12551229000101";"IVA IRIS SORAIA DE ANDRADE SANTOS 84654937404";"S";;203.773,98;;"NORMAL";"TECIDOS";"RECIFE";"I";14/10/2010;"GUILHERME COELHO DUARTE"
"041619200";"12507394000158";"JUCIARA CRISTINA MONTEIRO DA SILVA 06329544425";"A";6,45;82.172,86;;"SIMEI";"VAREJO";"CABO DE SANTO AGOSTINHO";"I";14/10/2010;
"041416872";"12397702000130";"LERONNY TEXTIL LTDA ME";"A";2.851,53;310.288,48;462.696,00;"SIMPLES NACIONAL";"TECIDOS";"CARUARU";"II";20/09/2010;"CHARLENE CHAGAS SILVA SANTOS"
"041405242";"12469273000169";"FONSECA FILHO COMERCIO DO VESTUARIO LTDA ME";"C";74.911,26;1.540.717,76;;"NORMAL";"TECIDOS";"RECIFE";"I";17/09/2010;"LUIZ CARLOS VILAR DO NASCIMENTO"
"041367561";"12456053000109";"CICERO DIAS DA SILVA 38089076491";"A";29,04;214.059,61;;"SIMEI";"SUPERMERCADOS";"JABOATAO DOS GUARARAPES";"I";14/09/2010;"SEBASTIAO MANOEL DA SILVA"
"041124316";"12329162000157";"ROBERTA DA SILVA 04264927498";"C";24,18;62.297,52;;"NORMAL";"VAREJO";"CAMARAGIBE";"I";14/09/2010;
"041116801";"12326555000107";"SONIA MARIA DE OLIVEIRA 10075042428";"A";3.514,34;152.812,04;;"SIMEI";"VAREJO";"RECIFE";"I";14/09/2010;
"041100484";"12319105000197";"JOSE JAILSON LUCENA DOS SANTOS";"B";369,81;15.685,93;;"NORMAL";"VAREJO";"BEZERROS";"II";14/09/2010;"LUCIA MARIA DA SILVA"
"041091981";"12314450000138";"GILBERTO ALVES DOS SANTOS JUNIOR 02573604500";"A";28,41;123.834,97;;"SIMEI";"TECIDOS";"PETROLINA";"III";14/09/2010;
"041071603";"12482767000183";"J N A COMERCIO DE UNIFORMES E ACESSORIOS LTDA";"C";155,64;212.557,49;523.812,34;"NORMAL";"TECIDOS";"OLINDA";"I";10/09/2010;"EDILSON NUNES DA SILVA"
"041057376";"12467615000101";"MAXAMBOMBA LTDA ME";"B";;220.524,69;;"NORMAL";"VAREJO";"OLINDA";"I";08/09/2010;"ROGER PONCE PEREIRA"
"040914348";"12302401000185";"JOSIVAM MANOEL RODRIGUES 04013992493";"A";2.470,00;185.217,11;;"SIMEI";"VAREJO";"PETROLINA";"III";14/08/2010;
"040902250";"12298218000153";"EDVALDO JOSE DA SILVA 61711047449";"A";12,94;410.464,01;;"SIMEI";"SUPERMERCADOS";"BARREIROS";"I";14/08/2010;"ANA PAULA CAVALCANTI ROCHA NEVES"
"040811611";"12264210000176";"RAQUEL S FERREIRA ME";"A";16.312,53;69.836,42;;"SIMPLES NACIONAL";"VAREJO";"IPOJUCA";"I";14/08/2010;"JAILSON HENRIQUE MARINHO DA SILVA"
"040691535";"12161825000177";"ALEXANDRE COELHO PIMENTEL 02392938431";"A";5.424,82;116.321,13;;"SIMEI";"VAREJO";"RECIFE";"I";14/08/2010;"MONICA JOSE NUNES DE BARROS"
"040667820";"12309429000144";"EDILSON DANIEL DOS REIS ME";"A";16,93;548.872,53;;"SIMEI";"CIGARROS";"PETROLINA";"III";13/08/2010;"CUSTODIA DE SOUZA SILVA"
"040665704";"12327168000195";"ANA PAULA A DA SILVA TRINDADE";"C";2.184,50;3.142,74;;"NORMAL";"TECIDOS";"GOIANA";"I";13/08/2010;"MARIA DO CARMO CAVALCANTI DA SILVA"
"040637590";"12279227000105";"JUDIVANIA DAS GRACAS ARAUJO MELO ME";"A";6.558,36;230.150,36;11.700,00;"NORMAL";"TECIDOS";"JATAUBA";"II";09/08/2010;"RENATO ALVES"
"040625400";"12247834000185";"BRASIL CANA E AGUA LTDA ME";"S";37.411,38;4.493.361,92;8.024.480,99;"NORMAL";"INDUSTRIA";"VITORIA DE SANTO ANTAO";"II";06/08/2010;"VALDEMAR LINO CHAVES NETO"
"040491366";"12094987000130";"NEILTON DA PAZ FERREIRA 71234276453";"A";;;;"SIMEI";"INDUSTRIA DE ALIMENTOS";"RECIFE";"I";22/07/2010;
"040440613";"12065808000136";"OSDANIA MARIA DA SILVA 76669920415";"A";28,16;227.716,03;;"SIMEI";"TECIDOS";"CABO DE SANTO AGOSTINHO";"I";22/07/2010;
"040416666";"12053959000174";"MARIA CELIA DE AGUIAR CAMPOS 34396870400";"C";26,01;92.297,26;;"NORMAL";"ATACADO DE ALIMENTOS";"RECIFE";"I";22/07/2010;"RANIERE JOSE DE SOUZA MENDES"
"040409023";"12049202000107";"MARIA DA CONCEICAO DA SILVA VERCOSA 71830596420";"A";274,58;84.259,13;;"SIMEI";"TECIDOS";"RECIFE";"I";22/07/2010;"PAULO RENAN JAQUES BEZERRA"
"040321959";"11711803000170";"FERNANDO MAXIMO DA SILVA GAS ME";"A";9.219,03;73.824.452,13;36.999.532,01;"SIMPLES NACIONAL";"COMBUSTIVEL";"CAMARAGIBE";"I";12/07/2010;"MANOEL DE LIMA BARBOSA"
"040320715";"06126485000221";"H A GONCALVES PRODUTOS OPTICOS EPP";"S";290.415,66;621.444,10;446.924,50;"SIMPLES NACIONAL";"VAREJO";"SERRA TALHADA";"II";12/07/2010;"FLAVIO JOSE MENDONCA RODRIGUES"
"040316602";"11926538000148";"J. F. DE LIMA ACESSORIOS ME";"S";8.787,58;137.801,66;;"SIMPLES NACIONAL";"TECIDOS";"CAMOCIM DE SAO FELIX";"II";09/07/2010;"MARIA ELIANE CAVALCANTI"
"040250326";"12084947000107";"E B DE FARIAS ME";"C";;332.381,47;;"NORMAL";"MEDICAMENTOS";"RECIFE";"I";21/06/2010;"HEIDY SILVA DO NASCIMENTO"
"040244008";"11740231000158";"MARCELO LEAL CORREA DE ARAUJO - ME";"S";1.517,01;10.635,38;185.360,20;"NORMAL";"TECIDOS";"RECIFE";"I";17/06/2010;"INALDO JOSE DA SILVA"
"040226700";"01515050000174";"LANGON COSMETICOS LTDA";"C";866.913,96;778.446,15;27.529.864,26;"CONTRIBUINTE SUBSTITUTO";"ATACADO";"CURITIBA";"I";14/06/2010;
"040088200";"11954733000181";"GISALDA CHALEGRE DOS SANTOS 04722231435";"C";121,54;2.304,00;;"NORMAL";"TECIDOS";"RECIFE";"I";11/06/2010;
"039957470";"11917803000121";"WK ALVES MOVEIS E DECORACOES LTDA";"S";25.062,07;809.833,27;164.287,35;"SIMPLES NACIONAL";"VAREJO";"CARUARU";"II";28/05/2010;"MAGNO JOSE CAVALCANTI BESERRA"
"039693554";"11832075000155";"PRO-VISUAL GRAFICA E EDITORA LTDA - ME";"A";169.035,18;4.890.027,95;15.202.061,34;"SIMPLES NACIONAL";"OUTRAS ATIVIDADES";"RECIFE";"I";28/04/2010;"SEVERINO HENRIQUE GAMA"
"039670422";"11285770000144";"CALCADAS MSP COMERCIO DE CONFECCOES LTDA";"C";1.784,27;268.118,97;22.363,99;"NORMAL";"TECIDOS";"RECIFE";"I";23/04/2010;"ARISTOTELES SANTIAGO FILHO"
"039626105";"11783086000192";"M J DE MIRANDA";"S";;121.542,11;;"NORMAL";"TECIDOS";"RIACHO DAS ALMAS";"II";13/04/2010;"MILSON SALES VIEIRA"
"039488543";"11615817000190";"AURICELIA LOURENCO LEITE 04519258405";"A";428,70;202.668,65;;"SIMEI";"TECIDOS";"PARNAMIRIM";"III";13/04/2010;"ADENOR LAUR NCIO LEITE"
"039487903";"11615329000183";"LUIZ DA S G NETO INFORMATICA ME";"A";14,56;7.057,00;24.000,00;"SIMEI";"VAREJO";"RECIFE";"I";13/04/2010;"PAULO ROBERTO CAMPELLO GUIMARAES"
"039395537";"11580860000168";"FRANCIMAR CAVALCANTE LIMA 83683763434";"A";252,08;4.217,96;;"SIMEI";"TECIDOS";"RECIFE";"I";05/04/2010;
"039303780";"11437754000120";"EMIRADOS CONFECCOES LTDA";"C";;35.611,28;5.400,00;"NORMAL";"TECIDOS";"VERTENTES";"II";25/03/2010;
"039260607";"11634487000180";"LAIS OTICA LTDA";"C";;38.438,09;;"NORMAL";"VAREJO";"ESCADA";"I";17/03/2010;"ANTONIO RILDO MATOS DE MIRANDA"
"039231429";"10619983000100";"GODOY & BAPTISTELLA INDUSTRIA E COMERCIO DE PRODUTOS HIGIENE LTDA";"C";;42.706,20;2.106.636,18;"CONTRIBUINTE SUBSTITUTO";"INDUSTRIA";"SANTA MARIA DA SERRA";"I";09/03/2010;
"039215903";"11595929000127";"ALINE RANIERE V. CONSTANTINO RESTAURANTE";"A";341,50;153.228,15;4.522,75;"SIMPLES NACIONAL";"VAREJO";"PAUDALHO";"I";05/03/2010;"MARCONES MANOEL DA SILVA"
"039166856";"11369446000104";"VALENTINA COMERCIO DE VESTUARIO IMPORTACAO E EXPORTACAO LTDA ME";"A";114.531,34;2.178.079,64;;"SIMPLES NACIONAL";"TECIDOS";"RECIFE";"I";19/02/2010;"GILSONILDO RIBEIRO COSTA"
"039139530";"11159919000149";"MARLENE MARGARIDA DE FARIAS CONFECCOES";"S";152,17;9.581,04;;"NORMAL";"TECIDOS";"CARPINA";"I";10/02/2010;"JOSE CARLOS RODRIGUES DE LIMA"
"039103773";"11475796000155";"KAMEDICA DISTRIBUIDORA DE MEDICAMENTOS LTDA EPP";"A";147.217,59;7.319.765,14;17.496.071,26;"NORMAL";"MEDICAMENTOS";"JABOATAO DOS GUARARAPES";"I";03/02/2010;"REYNALDO MENDES DA CUNHA"
"039100910";"11486898000176";"FABIANA CORDEIRO COMERCIO - ME";"A";3.136,57;351.909,88;1.203.170,08;"NORMAL";"TECIDOS";"OLINDA";"I";02/02/2010;"INALDO JOSE DA SILVA"
"039034275";"11450286000123";"MANDACARU ATACADO E COMERCIO LTDA ME";"C";567,73;2.117.170,37;648.544,20;"SIMPLES NACIONAL";"TECIDOS";"TORITAMA";"II";18/01/2010;"ROBERTO TORRES DE SALES JUNIOR"
"038925818";"11190994000172";"POSTO DE COMBUSTIVEIS EUROPA LTDA";"C";51,03;13.210.966,61;14.992.233,00;"NORMAL";"COMBUSTIVEL";"RECIFE";"I";21/12/2009;"GILBERTO MARTINS DA SILVA JUNIOR"
"038765004";"11307525000190";"E.J. TRINDADE LIMA DOGAO ME";"C";;749.594,05;;"NORMAL";"VAREJO";"OLINDA";"I";17/11/2009;"ROGER PONCE PEREIRA"
"038745321";"11274819000163";"TUPAN TECNOLOGIA E COMPONENTES ELETRONICOS LTDA";"C";;;;"NORMAL";"INDUSTRIA";"SALGUEIRO";"III";12/11/2009;"ERBERT FERNANDO DA SILVA"
"038742497";"04980258003097";"DRICOS MOVEIS E ELETRODOMESTICOS LTDA";"B";22.775,72;3.218.738,35;3.354.946,60;"NORMAL";"VAREJO";"CARUARU";"II";11/11/2009;"FRANCISCA MARIA BARBOSA ROCHA"
"038466368";"11115553000106";"ODAIR DE OLIVEIRA PINTO - ME";"S";;33.090,18;54.116,00;"NORMAL";"TECIDOS";"PAULISTA";"I";15/09/2009;
"038391767";"11087265000195";"MARIA A CORREIA - PAPELARIA ME";"S";;36.806,46;55.120,56;"NORMAL";"TECIDOS";"VITORIA DE SANTO ANTAO";"II";31/08/2009;"NEWTON RODRIGUES DA SILVA FILHO"
"038366061";"11053859000185";"ARCA ARMARINHO CAVALCANTI LTDA ME";"S";2.856,56;647.045,81;168.375,59;"NORMAL";"TECIDOS";"PESQUEIRA";"II";26/08/2009;"GERALDO MAGELA DE OLIVEIRA"
"038297230";"11018508000133";"IRISMAR OLIVEIRA DA SILVA CONFECCOES ME";"C";;;;"NORMAL";"TECIDOS";"CARUARU";"II";12/08/2009;"EDNALDO JOSE PEREIRA"
"038295539";"11001303000145";"NOBRART INDUSTRIA E COMERCIO LTDA";"C";;20.868,05;616.595,54;"NORMAL";"INDUSTRIA";"RECIFE";"I";12/08/2009;"ABDON ABEL DE LIMA"
"038256983";"06994981000388";"RAPHAEL GUIMARAES BRITTO EIRELI ME";"B";1.446,30;;;"NORMAL";"TECIDOS";"OLINDA";"I";31/07/2009;"JOAO VIEIRA DE CARVALHO"
"038129523";"10891287000140";"C. V. A. - COMERCIO VAREJISTA DE ALIMENTOS LTDA";"B";17.617,41;10.293.927,43;112.739,58;"NORMAL";"SUPERMERCADOS";"RECIFE";"I";01/07/2009;
"038091100";"28823805006861";"CREACOES OPCAO LTDA";"A";345.307,01;2.410.796,83;1.364.032,31;"NORMAL";"TECIDOS";"JABOATAO DOS GUARARAPES";"I";19/06/2009;"ALEX SANDRO JORGE DE BARROS"
"038046741";"10865042000149";"ITALA TARCIANE DE ALMEIDA VIEIRA - ME";"S";4.380,92;140.428,54;;"NORMAL";"TECIDOS";"CARUARU";"II";09/06/2009;"MICHEL JEAN PINHEIRO WANDERLEY"
"038012928";"10823488000100";"MARIO VITAL ARTIGOS DO VESTUARIO EIRELI";"S";1.632,40;102.969,69;81.171,20;"NORMAL";"TECIDOS";"OLINDA";"I";02/06/2009;"NEHEMIAS LINS DE SOUZA"
"038005042";"10711839000191";"JAILSON RIBEIRO DA SILVA ME";"C";;1.208,30;;"NORMAL";"TECIDOS";"ABREU E LIMA";"I";29/05/2009;"JOANA D ARC ALVES DA SILVA"
"037993879";"10810134000121";"ANDERSON WENDELL DE OLIVEIRA VESTUARIO ME";"C";214,72;56.531,36;123.784,00;"NORMAL";"TECIDOS";"CATENDE";"I";27/05/2009;
"037945394";"10796984000112";"CASA DOS AVIAMENTOS LTDA ME";"S";1.284,07;9.649,88;;"NORMAL";"TECIDOS";"OLINDA";"I";15/05/2009;"FRANCISCO ASSIS DOS SANTOS FILHO"
"037923900";"10784477000169";"RODRIGO BELO OSORIO - ME";"C";;125.649,33;;"NORMAL";"VAREJO";"CARUARU";"II";11/05/2009;"CHRISTIAN MARCELO MENDONCA LIMA"
"037859986";"10745502000103";"COSMETICOS INDUSTRIA E COMERCIO LTDA";"A";1.365,95;;;"NORMAL";"INDUSTRIA";"GOIANA";"I";22/04/2009;"MARCELE BORGES MILET MORAES"
"037809610";"10723798000153";"WWW MARTINHO INDUSTRIA DE ARTIGOS DO VESTUARIO LTDA ME";"S";11.241,63;184.453,66;;"NORMAL";"TECIDOS";"CARUARU";"II";08/04/2009;"JOSE SEVERINO SILVA DE PAULA"
"037679651";"04370774000165";"W.A.L INDUSTRIA E COMERCIO DE MOVEIS PARA ESCRITORIO LTDA";"C";144,00;179.082,68;681.090,49;"NORMAL";"INDUSTRIA";"RECIFE";"I";05/03/2009;"MURILO BATISTA LIPPO FILHO"
"037644947";"10632117000141";"FERREIRA E SILVA EPI LTDA ME";"C";7.210,75;765.185,20;1.641.554,37;"NORMAL";"TECIDOS";"PAUDALHO";"I";20/02/2009;"LUCI MARIA SILVA DO NASCIMENTO"
"037593340";"10621018000164";"DMARIE CONFECCAO E COMERCIO DE ARTIGOS DO VESTUARIO LTDA ME";"A";1.264,07;34.910,50;;"NORMAL";"TECIDOS";"RECIFE";"I";11/02/2009;"FABIANA CRISTINA MEDEIROS BARBOSA DO O"
"037578898";"10614093000106";"ROMULO SOUZA DOS SANTOS EIRELI ME";"S";10.570,51;404.265,11;;"SIMPLES NACIONAL";"VAREJO";"SALGUEIRO";"III";06/02/2009;"ADNA GOMES DA CUNHA"
"037513257";"10556198000148";"LOURIFARMA PRODUTOS FARMACEUTICOS LTDA ME";"C";282,90;2.823.334,31;;"NORMAL";"MEDICAMENTOS";"OLINDA";"I";26/01/2009;"REYNALDO MENDES DA CUNHA"
"037420089";"10534426000189";"ASTOLLI INDUSTRIA E COMERCIO DE PRODUTOS QUIMICOS LTDA - ME";"S";4.979,75;69.766,67;;"NORMAL";"INDUSTRIA";"JABOATAO DOS GUARARAPES";"I";30/12/2008;"ADISIO GENU DE FREITAS"
"037358340";"09532166000123";"FELIPE ANTONIO PESSOA DA SILVA FILHO";"B";;71.977,63;;"NORMAL";"TECIDOS";"SANTA CRUZ DO CAPIBARIBE";"II";12/12/2008;"FRANCISCO DE ASSIS FRANCA"
"037182471";"10416688000149";"MASTEX INDUSTRIA, COMERCIO, IMPORTACAO E EXPORTACAO DE PRODUTOS TEXTEIS LTDA";"A";175.664,16;18.450.625,80;11.134.382,56;"SIMPLES NACIONAL";"TECIDOS";"CARUARU";"II";30/10/2008;"GILBERTO ANTONIO DA SILVA"
"037055607";"10299460000116";"FERNANDA MARIA DE LIMA COMERCIO";"S";33.372,04;921.627,91;;"NORMAL";"TECIDOS";"CARUARU";"II";02/10/2008;"LUIZ CARLOS FERREIRA DA COSTA"
"036981494";"10320339000129";"PRIVATE LABEL INDUSTRIA E COMERCIO DE CONFECCOES LTDA";"C";;;;"NORMAL";"TECIDOS";"CARUARU";"II";17/09/2008;
"036884456";"10219033000180";"ROSELIA & STEFFANE MODAS LTDA ME";"C";98,83;;;"NORMAL";"TECIDOS";"PAUDALHO";"I";08/08/2008;"IVONETE SIEBRA BARBOSA"
"036828386";"10193535000180";"LANA LETICIA BARROS CAMILO";"S";2.005,02;96.934,92;;"NORMAL";"TECIDOS";"CARUARU";"II";28/07/2008;
"036791016";"10171769000126";"R S DE FREITAS TECIDOS";"S";175.170,99;921.582,94;125.196,89;"SIMPLES NACIONAL";"TECIDOS";"RECIFE";"I";22/07/2008;"PEDRO PAULO MIRANDA DE FIGUEIREDO"
"036681008";"09610773000164";"MJ COMERCIO IMPORTACAO E EXPORTACAO DE ALIMENTOS LTDA";"C";;98,49;;"NORMAL";"INDUSTRIA DE ALIMENTOS";"RECIFE";"I";18/06/2008;
