IE;CNPJ;RAZAO;SIT;ARRECADACAO;ENTRADAS;SAIDAS;REGIME;SEGM;MUNICIPIO;DRR;DATA-IE;CONTADOR
"068684525";"26039957000135";"PEDRA REDONDA COMERCIAL DE ALIMENTOS EIRELI";"C";2.373,00;9.830.396,71;5.160.742,47;"NORMAL";"INDUSTRIA DE ALIMENTOS";"PESQUEIRA";"II";26/08/2016;"GILSON BEZERRA DA SILVA"
"068681933";"26037712000179";"COMERCIAL LUA NOVA EIRELI EPP";"C";;1.214.454,94;2.951.634,66;"NORMAL";"INDUSTRIA DE ALIMENTOS";"RECIFE";"I";26/08/2016;
"068679360";"26008899000182";"GEORGE DE LIMA PIMENTEL MERCADOS EPP";"B";;374.403,26;;"NORMAL";"SUPERMERCADOS";"BREJAO";"II";25/08/2016;
"068635583";"23020312000162";"RUAN DE SOUZA LIMA 12580302417";"A";19.313,01;478.799,41;;"SIMPLES NACIONAL";"TECIDOS";"SURUBIM";"II";22/08/2016;"MARIA GILVANIA PEREIRA CLEMENTE"
"068628617";"25966012000104";"ROSEANE ALBUQUERQUE DE ARRUDA 06089122475";"S";1.671,27;252.964,82;;"SIMPLES NACIONAL";"TECIDOS";"IGARASSU";"I";22/08/2016;"MAURO MARINHO DA SILVA"
"068610750";"25753707000108";"RINALDO CARVALHO BARBOSA 37543644487";"A";21,11;85.791,20;;"SIMEI";"VAREJO";"RECIFE";"I";22/08/2016;
"068590890";"25965403000104";"L MANOEL DA SILVA BEBIDAS ME";"C";;3.836.492,10;;"NORMAL";"BEBIDAS";"IBIMIRIM";"II";17/08/2016;
"068573375";"25526729000127";"LUCIANA GOMES DA SILVA 07656529438";"S";17,12;240.050,08;;"SIMPLES NACIONAL";"VAREJO";"RECIFE";"I";15/08/2016;
"068534809";"16585716000138";"EVALDO HENRIQUE FERREIRA DA SILVA 03649297400";"A";592,70;198.969,28;621,40;"SIMEI";"VAREJO";"SAO JOAO";"II";15/08/2016;"ALBERTO SANTOS MARTINS"
"068462387";"25358808000176";"LUIZ HENRIQUE ALBUQUERQUE MEDEIROS 09854919498";"C";;92.248,40;;"SIMEI";"VAREJO";"CARUARU";"II";08/08/2016;
"068454953";"25352226000182";"EDIVANIA DE LIMA AZEVEDO MATEUS DA COSTA 05969017477";"A";1.515,52;134.110,33;;"SIMEI";"TECIDOS";"NAZARE DA MATA";"I";08/08/2016;
"068399324";"25326385000102";"EDNALDO AGRIPINO DA NATIVIDADE 58882316491";"A";22,39;173.191,21;;"SIMEI";"VAREJO";"RECIFE";"I";01/08/2016;
"068305877";"25301034000147";"JOHNATAN & L ALIMENTO LTDA EPP";"C";;3.871.007,20;413.550,27;"SIMPLES NACIONAL";"SUPERMERCADOS";"CONDADO";"I";27/07/2016;"SAMUEL RAMOS PAZ DE FREITAS DOMINGOS"
"068285230";"25265369000157";"JULIANA EMILIA PEREIRA BARBOSA 09946877457";"A";2.314,43;132.608,52;118.465,01;"SIMEI";"VAREJO";"SANTA CRUZ DO CAPIBARIBE";"II";25/07/2016;
"068276834";"25259467000181";"ALESSANDRA ROBERTA VERCOSA DOS SANTOS 12683190409";"A";18,12;124.897,56;;"SIMEI";"SUPERMERCADOS";"BARREIROS";"I";25/07/2016;
"068143958";"25181493000134";"MICAELE BERNADINO SILVA 08115693499";"A";572,50;213.680,77;;"SIMEI";"TECIDOS";"SANTA CRUZ DO CAPIBARIBE";"II";20/07/2016;"JOSEFA DE SOUZA COSTA LEAL"
"068129025";"25240817000168";"BLENNDEDD EIRELI ME";"A";112.196,16;2.669.310,19;908.349,23;"NORMAL";"TECIDOS";"SURUBIM";"II";20/07/2016;"HERLLA GINYANA CORDEIRO PRADO"
"068120230";"25162023000123";"ROSEMERE CAMPOS DA SILVA 54700175400";"S";;117.063,30;;"NORMAL";"VAREJO";"CARUARU";"II";19/07/2016;
"068114427";"25157776000140";"EMANUEL ALFREDO CORDEIRO CASSIMIRO 84938773449";"A";4.578,88;165.223,36;;"SIMEI";"VAREJO";"RECIFE";"I";19/07/2016;"ELIANE DE MORAES AMORIM"
"068113536";"25157076000156";"MOISES LUIZ JUNIOR 04203547431";"A";3.794,75;239.682,56;;"SIMEI";"VAREJO";"RECIFE";"I";19/07/2016;
"068051751";"25227427000158";"G B DE FREITAS EIRELI EPP";"C";;2.249.543,24;1.703.900,07;"NORMAL";"BEBIDAS";"FLORES";"II";18/07/2016;
"068028423";"25186132000180";"ANDRE SEVERINO DA SILVA COMERCIO E SERVICOS ME";"A";3.048,18;134.020,34;290.879,38;"SIMPLES NACIONAL";"SUPERMERCADOS";"GOIANA";"I";12/07/2016;"FELIPE AUGUSTO BEZERRA DA SILVA"
"068023707";"25175532000190";"VDR COMERCIO VAREJISTA DE ROUPAS LTDA ME";"S";74.981,45;773.563,93;54.474,35;"SIMPLES NACIONAL";"TECIDOS";"RECIFE";"I";11/07/2016;"SIMONE MARTINS ARAUJO"
"068021682";"25166021000102";"JOSE CRESCENCIO BARBOSA & CIA LTDA ME";"C";1.818,01;1.979.451,13;841.183,15;"NORMAL";"TECIDOS";"SANTA CRUZ DO CAPIBARIBE";"II";11/07/2016;"JOSIEL AUGUSTO DA SILVA"
"068013159";"25157202000172";"LUIZ ALVES DE OLIVEIRA NETTO TRANSPORTES ME";"A";239,30;1.634.700,48;170.540,00;"SIMPLES NACIONAL";"TRANSPORTE";"GARANHUNS";"II";07/07/2016;"JOAO PAULO DE OLIVEIRA FERREIRA"
"068011105";"25145205000196";"LADIES AND GENTLEMEN EIRELI ME";"C";;4.514,54;;"NORMAL";"TECIDOS";"OLINDA";"I";07/07/2016;"EDMILSON SILVA DE ANDRADE"
"067994008";"25120527000180";"MARCOS ANDRE DOS SANTOS SILVA 08039734460";"A";19,25;279.608,28;;"SIMEI";"ATACADO DE ALIMENTOS";"JABOATAO DOS GUARARAPES";"I";06/07/2016;"MARIA DE FATIMA FERREIRA DE MACEDO"
"067988296";"25114605000134";"LIDIANE PEREIRA DE BRITO 04821849496";"A";8,74;164.625,24;;"SIMEI";"VAREJO";"RECIFE";"I";06/07/2016;
"067883354";"25049754000167";"ALLAN FRANCISCO ROQUE DIAZ 00751759406";"A";21,63;208.671,67;627,00;"SIMEI";"VAREJO";"RECIFE";"I";27/06/2016;
"067870023";"25039402000120";"JEISA BEZERRA VILA NOVA 09668000447";"S";;547.941,99;;"SIMPLES NACIONAL";"INDUSTRIA DE ALIMENTOS";"RECIFE";"I";27/06/2016;"RILDO DE QUEIROZ SARAIVA"
"067820352";"25003900000113";"FERNANDA BRUNNELLY ALVES DE OLIVEIRA 07677799400";"A";7,08;418.078,59;;"SIMEI";"SUPERMERCADOS";"PALMARES";"I";21/06/2016;
"067770070";"24978585000187";"J. F. DE MACEDO JUNIOR CONFECCOES ME";"C";10.730,25;599.769,80;1.558.495,92;"SIMPLES NACIONAL";"TECIDOS";"TAQUARITINGA DO NORTE";"II";16/06/2016;"FLAVIO CAVALCANTI DOS SANTOS"
"067769659";"24968991000169";"CLAUDIO F DA CRUZ MERCADOS ME";"B";;632.636,72;98.606,00;"NORMAL";"SUPERMERCADOS";"RIACHO DAS ALMAS";"II";16/06/2016;
"067712703";"24956742000153";"ANDRE SEIXAS SILVA 04358967418";"A";2.444,33;128.480,17;;"SIMEI";"VAREJO";"RECIFE";"I";14/06/2016;
"067693300";"24942375000139";"SILMARA DE LIMA ARRUDA 70279930402";"A";15.162,24;155.020,62;;"SIMEI";"VAREJO";"PETROLINA";"III";14/06/2016;"IVANILDO PEREIRA GUIMARAES"
"067674941";"24971752000168";"COMERCIAL PONTE VELHA EIRELI EPP";"C";;2.600.816,83;2.637.262,60;"NORMAL";"INDUSTRIA DE ALIMENTOS";"RECIFE";"I";09/06/2016;
"067631894";"24919604000102";"ROBERTA SOUZA DE OLIVEIRA 06102858662";"A";927,60;114.766,19;;"SIMEI";"TECIDOS";"CARUARU";"II";06/06/2016;"ERNANDO HELENO DA SILVA"
"067624332";"24913756000190";"ANDERSON RODRIGUES DE SOUZA ARAUJO 05423859450";"A";2.608,36;185.679,40;;"SIMEI";"ATACADO DE ALIMENTOS";"IGARASSU";"I";06/06/2016;
"067599800";"24896178000120";"MARIA LUIZA DA SILVA 15257762404";"A";460,55;127.642,94;;"SIMEI";"TECIDOS";"CACHOEIRINHA";"II";06/06/2016;
"067598587";"24895068000144";"ELIELDO LOPES DA SILVA 13759227422";"A";;212.470,74;;"SIMEI";"ATACADO DE ALIMENTOS";"IPUBI";"III";06/06/2016;
"067591906";"24890025000176";"EVANDRO JOSE BET 04803239924";"A";24,02;616.772,43;;"SIMEI";"VAREJO";"RECIFE";"I";06/06/2016;
"067586813";"24932229000122";"M M NUNES DE SOUSA CONFECCOES ME";"C";40.284,07;5.626.810,00;6.765.491,97;"SIMPLES NACIONAL";"TECIDOS";"SANTA CRUZ DO CAPIBARIBE";"II";06/06/2016;
"067564330";"24881329000177";"SEVERINA SOARES PINTO 54389984420";"A";;115.387,14;;"SIMEI";"ATACADO DE ALIMENTOS";"RECIFE";"I";31/05/2016;
"067451217";"24831346000108";"CECILIA ELIZABETE FLORENTINO DE SOUZA 09800707409";"A";11,54;224.697,64;;"SIMEI";"BEBIDAS";"PAULISTA";"I";23/05/2016;
"067420842";"24810938000135";"ZENALDO ALVES FERREIRA DA SILVA 00989786404";"A";168,28;135.744,50;;"SIMEI";"TECIDOS";"RECIFE";"I";23/05/2016;
"067411690";"24804706000174";"PAULO RENATO DA SILVA INACIO 07789914405";"A";;244.821,67;;"SIMEI";"VAREJO";"PETROLINA";"III";23/05/2016;
"067398065";"24842647000129";"STEELSERVICE LOGISTICA E INDUSTRIA LTDA";"A";32.835,77;15.170.995,70;14.442.277,10;"NORMAL";"TRANSPORTE";"CABO DE SANTO AGOSTINHO";"I";20/05/2016;"ANTONIO VIEIRA DE BARROS FILHO"
"067382908";"24814878000129";"LIZERDE BEZERRA DO NASCIMENTO EPP";"C";;7.396,32;8.961.723,04;"NORMAL";"ATACADO";"AGUA PRETA";"I";17/05/2016;
"067302211";"24806568000162";"COMERCIAL NOVO CARVALHO EIRELI EPP";"C";;3.343.808,73;5.670.036,27;"NORMAL";"INDUSTRIA DE ALIMENTOS";"RECIFE";"I";16/05/2016;
"067298273";"24791843000111";"E GALDINO DE OLIVEIRA CONFECCOES";"C";10.924,66;919.050,89;903.254,60;"SIMPLES NACIONAL";"TECIDOS";"SANTA CRUZ DO CAPIBARIBE";"II";16/05/2016;
"067293638";"24790914000161";"COMERCIAL PEGA LEVE EIRELI EPP";"C";3.239,58;2.996.885,75;;"NORMAL";"SUPERMERCADOS";"VITORIA DE SANTO ANTAO";"II";16/05/2016;
"067271316";"24745426000132";"SCHIRLLEY PATRICIA LOUREIRO AZEVEDO 86642588487";"A";;84.806,19;;"SIMEI";"TECIDOS";"RECIFE";"I";10/05/2016;
"067236081";"24720629000174";"CAIO ANDRIO DE ANDRADE BEZERRA 11493802410";"A";13,89;2.562,60;;"SIMEI";"TECIDOS";"RECIFE";"I";10/05/2016;
"067204635";"24708306000165";"RODRIGO HENRIQUE MONTEIRO LOPES 08263812437";"A";20,03;;98.685,20;"SIMEI";"MATERIAL DE CONSTRUCAO";"CABO DE SANTO AGOSTINHO";"I";10/05/2016;
"067153461";"24677340000110";"LEURICE HIGINO CARLOS CONFECCAO";"C";12,35;270,00;130.896,00;"NORMAL";"TECIDOS";"TORITAMA";"II";04/05/2016;
"067144209";"24520724000124";"ALEXSANDRO ARAUJO FERREIRA 01285633466";"A";4,37;232,10;120.068,25;"SIMEI";"VAREJO";"SIRINHAEM";"I";04/05/2016;
"067125921";"24660142000143";"JOSE ALVES FERREIRA 94014973891";"A";3.106,34;106.354,30;;"SIMEI";"ATACADO DE ALIMENTOS";"PETROLINA";"III";04/05/2016;"LEILIANNE EMELUCI SOARES COSTA"
"067101585";"21941707000172";"ALFA COMERCIO VAREJISTA DE ALIMENTOS LTDA  ME";"C";4.596,38;3.220.774,24;;"NORMAL";"ATACADO DE ALIMENTOS";"NAZARE DA MATA";"I";03/05/2016;
"067093620";"24689791000177";"TORQUATO & SOUZA CONFECCOES LTDA ME";"A";174.981,09;12.528.437,89;1.739.877,77;"NORMAL";"TECIDOS";"CARUARU";"II";29/04/2016;
"067089860";"24680484000125";"MACIEL BARROS CESAR & CIA LTDA EPP";"B";11.941,84;3.881.912,49;1.220.424,80;"SIMPLES NACIONAL";"TECIDOS";"SANTA CRUZ DO CAPIBARIBE";"II";29/04/2016;
"067080561";"24644274000181";"LUIZ CARLOS DO NASCIMENTO 02046471423";"A";25,02;392.601,74;;"SIMEI";"BEBIDAS";"PETROLINA";"III";28/04/2016;"SUELI DA SILVA COELHO"
"066922062";"24299862000206";"BZAWRY INDUSTRIA E COMERCIO DE CONFECCOES LTDA. ME";"A";;59.870,00;;"SIMPLES NACIONAL";"TECIDOS";"TORITAMA";"II";14/04/2016;"UBIRAJARA FABRICIO DA SILVA"
"066920957";"24593632000174";"CENTRO DE DISTRIBUICAO DE ALIMENTOS LEITE E FERNANDES EIRELI ME";"C";;2.822.452,60;696.580,85;"NORMAL";"ATACADO DE ALIMENTOS";"CARPINA";"I";14/04/2016;"GRAZIELE CRISTINA RODRIGUES DE MOURA"
"066914124";"09370788000100";"MULT SERVICO DE FACCAO DE PECA DO VESTUARIO LTDA";"S";9.323,15;1.444.645,49;1.595.849,12;"NORMAL";"TECIDOS";"RECIFE";"I";13/04/2016;"LUIZ CAVALCANTE JUNIOR"
"066911613";"24574802000173";"NILTON NACITO GONCALVES ME";"S";2.027,08;65.032,67;427.449,43;"NORMAL";"TECIDOS";"RECIFE";"I";12/04/2016;"SANDRA ROGERIA CESARIO DA SILVA"
"066884624";"24542503000157";"FLAVIA GONCALVES DA SILVA 89871057415";"B";24,12;273.520,20;;"NORMAL";"INDUSTRIA DE ALIMENTOS";"PAULISTA";"I";11/04/2016;
"066879035";"23830167000185";"MARIA DO SOCORRO TEJO CAMINHA 30437555453";"A";16,00;161.238,27;;"SIMEI";"VAREJO";"RECIFE";"I";11/04/2016;
"066867371";"24532783000112";"ERALDO DOS SANTOS LUMINATO 08564160455";"C";17,02;106.018,57;;"NORMAL";"TECIDOS";"SANTA CRUZ DO CAPIBARIBE";"II";11/04/2016;
"066823404";"24566651000101";"JLSP COMERCIO DE PRODUTOS NATURAIS EIRELI ME";"S";14.379,22;934.634,35;;"NORMAL";"ATACADO DE ALIMENTOS";"RECIFE";"I";11/04/2016;"MANOELA ANDRESSA DE AGUIAR CAMPELO"
"066777976";"24493650000184";"AMANDA ALIAN DA SILVA 08140208442";"S";1.437,31;260.453,00;;"NORMAL";"TECIDOS";"CARUARU";"II";04/04/2016;"DILMA DE SOUSA"
"066767822";"24486751000128";"R.M. DE OLIVEIRA E SILVA ME";"S";;966.910,60;17.975,10;"SIMPLES NACIONAL";"BEBIDAS";"BONITO";"II";04/04/2016;
"066757517";"24479128000148";"R P DA SILVA CONFECCAO - ME";"C";2.563,40;3.323.661,44;3.246.979,80;"NORMAL";"TECIDOS";"SANTA CRUZ DO CAPIBARIBE";"II";04/04/2016;
"066718619";"24494597000136";"NICOLE OLIVEIRA LOPES MACIEL EPP";"S";177,20;15.046,40;;"NORMAL";"TECIDOS";"RECIFE";"I";31/03/2016;"JONATH DE LIMA SANTOS"
"066702020";"24429478000108";"J M C COMERCIO E REPRESENTACOES EIRELI EPP";"C";598,52;24.082.142,33;13.845.886,96;"NORMAL";"BEBIDAS";"OLINDA";"I";29/03/2016;
"066697603";"24465116000164";"PONTO BOM ENTREGAS DE ACAI - EIRELI ME";"S";7.773,41;265.503,81;;"NORMAL";"VAREJO";"RECIFE";"I";29/03/2016;"FRANCISCA PEDROZO DA MATA JALES"
"066694760";"24448856000192";"RESTAURANTE E LANCHONETE O GONZAGAO LTDA ME";"S";869,89;52.929,52;;"SIMPLES NACIONAL";"VAREJO";"POMBOS";"II";29/03/2016;"LIDIAN GOMES DA SILVA"
"066689414";"24434835000118";"J O P DA SILVA - TECIDOS";"S";11.139,98;1.233.035,60;;"NORMAL";"TECIDOS";"LIMOEIRO";"I";29/03/2016;"JOAO CARLOS DA FONSECA"
"066607205";"24413717000123";"MAYKON DOUGLLAS DE SOUZA FIRMO 09704721455";"A";8,86;139.661,15;;"SIMEI";"TECIDOS";"JOAO ALFREDO";"I";21/03/2016;
"066543983";"24385186000102";"KELLY & JOSE CONFECCOES LTDA ME";"C";;382.682,28;895.168,20;"NORMAL";"TECIDOS";"SANTA CRUZ DO CAPIBARIBE";"II";18/03/2016;
"066530571";"24393052000133";"COMERCIAL LADO A LADO EIRELI EPP";"C";;1.434.258,48;8.266.195,24;"NORMAL";"BEBIDAS";"SAO JOSE DA COROA GRANDE";"I";16/03/2016;
"066473241";"24338237000145";"VSFO COMERCIO E SERVICOS DE HOTELARIA EIRELI  ME";"C";1.714,47;41.738,68;55.735,50;"NORMAL";"TECIDOS";"RECIFE";"I";15/03/2016;
"066448212";"24373184000101";"SJS COMERCIAL DE ALIMENTOS EIRELI EPP";"C";2.598,48;17.568.468,54;5.221.147,90;"NORMAL";"BEBIDAS";"RECIFE";"I";14/03/2016;
"066414237";"21542810000140";"JOSE WANDERSON DE SOUZA ALMEIDA 07178183497";"A";47,41;102.752,60;;"SIMEI";"TECIDOS";"ITAIBA";"II";07/03/2016;"VALDOMIRO DOS SANTOS MARTINS"
"066339782";"05136880001032";"FIO JEITOSO INDUSTRIA E COMERCIO DE CONFECCOES LTDA";"C";56.092,39;677.354,38;1.035.688,55;"NORMAL";"TECIDOS";"RECIFE";"I";04/03/2016;"LIZ RAQUEL GOMES ELOI"
"066309522";"24260484000176";"SERGIO VINICIUS ALVES DA CRUZ 12249746460";"A";;97.915,79;;"SIMEI";"VAREJO";"CABO DE SANTO AGOSTINHO";"I";29/02/2016;
"066304210";"24256791000183";"EVERTON HENRIQUE PEREIRA GONCALVES DA SILVA 05308017441";"A";395,22;505.759,01;;"SIMEI";"ATACADO DE ALIMENTOS";"CARUARU";"II";29/02/2016;
"066250706";"24251877000113";"MILDRED VANCE DE FIGUEIREDO RAMOS 15269000415";"A";8,83;98.285,00;;"SIMEI";"TECIDOS";"OLINDA";"I";29/02/2016;
"066183596";"24195488000118";"ERICA MILENA BARROS PEREIRA 04010474408";"S";24,13;343.200,82;;"SIMPLES NACIONAL";"VAREJO";"PAULISTA";"I";22/02/2016;
"066138531";"24165799000134";"JOSE CORREA DE ARAUJO JUNIOR 04657035428";"A";450,94;201.594,94;40.053,08;"SIMEI";"TECIDOS";"RECIFE";"I";22/02/2016;
"066122104";"24198239000186";"MARCO A. C. DE MELO EMBALAGENS EIRELI ME";"A";18.958,11;1.914.698,27;1.227.090,37;"NORMAL";"INDUSTRIA";"TIMBAUBA";"I";18/02/2016;"JOSEMAR GONCALVES DE SANTANA"
"066121990";"24197705000109";"M C ATACAREJO EIRELI  ME";"C";1.244,57;9.620.278,14;4.377.452,95;"NORMAL";"ATACADO DE ALIMENTOS";"OLINDA";"I";18/02/2016;
"066118182";"24187894000139";"A P RODRIGUES DE MELO TECIDOS ME";"A";56.665,65;4.373.218,99;666.900,40;"NORMAL";"TECIDOS";"BREJO DA MADRE DE DEUS";"II";17/02/2016;
"066115590";"24185565000159";"COMERCIAL SERRA BRANCA EIRELI EPP";"C";;825.730,00;412.197,70;"NORMAL";"BEBIDAS";"AGUAS BELAS";"II";17/02/2016;
"066038316";"24104959000135";"CRISTIANA MARIA DE SOUZA 04727952440";"A";772,41;203.672,60;;"SIMEI";"TECIDOS";"JABOATAO DOS GUARARAPES";"I";15/02/2016;
"065978820";"24062938000102";"COMERCIAL ABREU E COSME LTDA ME";"C";;15.992.831,90;;"SIMPLES NACIONAL";"SUPERMERCADOS";"CUPIRA";"II";03/02/2016;
"065975308";"24101760000153";"FABIO JUNIOR DE MORAIS RESTAURANTE E LANCHONETE ME";"S";1.120,67;49.002,21;;"SIMPLES NACIONAL";"VAREJO";"PETROLINA";"III";02/02/2016;"SERGIO LUIZ SANTANA"
"065939336";"24068077000161";"TATYANA KARLA PEREIRA BARBOZA 02837799424";"A";8.765,26;199.087,14;;"SIMEI";"TECIDOS";"JAQUEIRA";"I";01/02/2016;"SUELI MARIA TELES SOARES"
"065872240";"24014990000185";"WASHINGTON CARLOS DOS SANTOS ESTOFADOS ME";"S";581,69;38.799,50;78.685,00;"SIMPLES NACIONAL";"VAREJO";"CARUARU";"II";26/01/2016;"SEVERINO EVANGELISTA DE MELO"
"065826485";"24014491000198";"JOSEFA ADRIANA BEZERRA DA SILVA 05794389451";"A";2.691,44;193.845,94;;"SIMEI";"ATACADO DE ALIMENTOS";"BREJO DA MADRE DE DEUS";"II";25/01/2016;
"065756509";"23981697000124";"MESSIAS JOSE DA SILVA 08507535461";"A";13,50;150.740,77;;"SIMEI";"TECIDOS";"RECIFE";"I";19/01/2016;
"065674448";"23971172000108";"TCS COMERCIO DO VESTUARIO E ARTIGOS ESPORTIVOS LTDA ME";"A";8.699,86;146.988,15;;"SIMPLES NACIONAL";"TECIDOS";"RECIFE";"I";14/01/2016;"FABIO JOSE DA SILVA"
"065644026";"23925422000173";"THAMIRES ANDREA VALENCA ESPINDOLA 11185086455";"A";3.936,38;222.393,18;;"SIMEI";"TECIDOS";"TACAIMBO";"II";11/01/2016;
"065574737";"23923798000149";"CARDOSO COMERCIO E REPRESENTACOES EIRELI EPP";"C";587,20;10.913.540,81;30.118.428,89;"NORMAL";"BEBIDAS";"RECIFE";"I";07/01/2016;
"065529863";"23897130000174";"LUSINETE MARIA DE SENA MIRANDA 28409590468";"A";1.593,95;112.062,76;;"SIMEI";"VAREJO";"SAO LOURENCO DA MATA";"I";05/01/2016;"FABIO LUIZ CAVALCANTI DE MORAIS"
"065484401";"23865954000162";"EDINILSON JOAO DA SILVA 07136965403";"B";30,10;1.075.601,23;;"NORMAL";"VAREJO";"OLINDA";"I";23/12/2015;"JANEIDE DOMINGOS DOS SANTOS LIMA"
"065460219";"23846552000110";"LUAN FAGNER DE AGUIAR SANTOS 12469689406";"A";3,48;585.696,02;;"SIMEI";"TELECOMUNICACAO";"POMBOS";"I";23/12/2015;
"065435532";"22253965000200";"JOSELITO BEZERRA MODA FEMININA EIRELI ME";"S";12.893,04;108.805,56;;"NORMAL";"TECIDOS";"RECIFE";"I";22/12/2015;"MARIA DE FATIMA XAVIER DE ANDRADE"
"065399048";"23826205000126";"SILVANIA JORDAO DE OLIVEIRA 04021545417";"A";24,00;85.368,25;;"SIMEI";"INDUSTRIA";"PAULISTA";"I";14/12/2015;
"065344901";"23796759000128";"MARIA IRACI DA SILVA 05091372458";"A";32,57;14.846,66;118.481,00;"SIMEI";"VAREJO";"LAJEDO";"II";09/12/2015;
"065344499";"23796405000183";"FABIO JOSE DA SILVA 04393269403";"A";3.261,71;184.299,25;;"SIMEI";"TECIDOS";"ESCADA";"I";09/12/2015;
"065337360";"23792073000169";"FABIANO GONCALVES DA SILVA 09218966464";"A";21.129,26;19.950,00;159.525,60;"SIMPLES NACIONAL";"MATERIAL DE CONSTRUCAO";"ARARIPINA";"III";09/12/2015;
"065261364";"23776666000131";"F F SILVA DE OLIVEIRA TECIDOS ME";"C";32.762,81;1.184.616,29;393.591,40;"SIMPLES NACIONAL";"TECIDOS";"SANTA CRUZ DO CAPIBARIBE";"II";03/12/2015;
"065223357";"23739321000108";"MARIA EDUARDA LAFAYETTE GUIMARAES 11481516485";"C";26,40;31.773,02;;"SIMEI";"TECIDOS";"RECIFE";"I";01/12/2015;
"065177061";"23751599000109";"NICOLE C RODRIGUES DA SILVA ME";"S";;27.807,73;167.543,49;"NORMAL";"TECIDOS";"RECIFE";"I";30/11/2015;
"065172345";"23732643000125";"COMERCIAL LAGOA DO OURO ALIMENTOS LTDA EPP";"C";;792.466,39;144.529,80;"NORMAL";"SUPERMERCADOS";"LAGOA DO OURO";"II";27/11/2015;
"065132556";"23695708000100";"NAYARA DA R. ARAUJO ME";"A";1.291,26;154.682,37;;"SIMPLES NACIONAL";"VAREJO";"CARUARU";"II";24/11/2015;"ANA PAULA DE LIRA JORDAO"
"065086856";"23715685000158";"REGINARIA ELUIZA DA SILVA CONFECCOES ME";"S";142.378,15;4.766.942,01;1.586.727,70;"NORMAL";"TECIDOS";"SANTA CRUZ DO CAPIBARIBE";"II";24/11/2015;
"065085965";"23722942000189";"M. A. F. MIRANDA COMERCIO DE BEBIDAS";"C";;2.431.470,91;;"NORMAL";"BEBIDAS";"RECIFE";"I";24/11/2015;
"065059107";"23666714000139";"CARLOS MATIAS DE ANDRADE 06374524454";"A";751,27;391.989,60;;"SIMEI";"VEICULOS";"IGARASSU";"I";17/11/2015;
"065051203";"23662934000194";"MARIA DE FATIMA DA SILVA 01401817416";"A";16,79;500.926,42;;"SIMEI";"BEBIDAS";"PETROLANDIA";"III";17/11/2015;
"065032764";"23652588000163";"JOAO BRAZ BISPO NETTO 10432279466";"A";4.082,93;136.003,08;;"SIMEI";"VAREJO";"AGUA PRETA";"I";17/11/2015;"ANDRE FELIPE SOARES PEREIRA"
"065020324";"23646223000126";"TIAGO JACKSON DA SILVA NASCIMENTO 05103714426";"C";21,86;286.397,40;;"NORMAL";"VAREJO";"CARUARU";"II";17/11/2015;
"065009789";"23638469000156";"NELSON VITOR ALVES FILHO ME";"C";;6.473.185,70;11.070,00;"NORMAL";"VAREJO";"RECIFE";"I";17/11/2015;
"064993507";"23629037000189";"LUANNA ALINE ANDRADE DA SILVA 10521335418";"A";575,05;150.795,42;;"SIMEI";"ATACADO DE ALIMENTOS";"RECIFE";"I";17/11/2015;
"064967760";"06278224000227";"FERREIRA MODA E CONFECCOES LTDA - ME";"B";241,32;258.938,80;;"NORMAL";"TECIDOS";"PAULISTA";"I";12/11/2015;"AURINO LOPES DE SANT ANNA"
"064958426";"23634501000125";"GABRIEL N SANTOS ME";"A";17.391,66;1.346.240,20;;"SIMPLES NACIONAL";"TECIDOS";"SANTA CRUZ DO CAPIBARIBE";"II";11/11/2015;"PEDRO CARLOS TABOSA DO NASCIMENTO"
"064955591";"19274997000287";"DIANA MARIA COSTA - EIRELI - ME";"C";;85.850,00;97.680,00;"NORMAL";"SUPERMERCADOS";"SERRA TALHADA";"II";10/11/2015;"JORGE ANDRE DOS SANTOS VASCONCELOS"
"064925765";"23605480000110";"KARINA JENUINO DOS SANTOS 09981968439";"A";23,81;363.636,47;;"SIMEI";"VAREJO";"RECIFE";"I";09/11/2015;"JAMERSON PAULO DA SILVA"
"064898180";"23589233000177";"CLEIDE FLORENTINO DA SILVA 05728767427";"A";;195.300,29;;"SIMEI";"TECIDOS";"IPOJUCA";"I";09/11/2015;
"064862666";"23588988000157";"DISTRIBUIDORA PERNAMBUCANA DE ALIMENTOS EIRELI  ME";"B";475,30;3.460.008,35;1.440.516,84;"NORMAL";"SUPERMERCADOS";"RECIFE";"I";04/11/2015;
"064840182";"23571245000174";"IVAN MARCIO DA SILVA 02679148495";"A";229,17;197.126,48;;"SIMEI";"VAREJO";"CARUARU";"II";03/11/2015;
"064833640";"23566550000178";"MARIA DE LOURDES BENVINDA DA SILVA 33573140459";"A";20,81;556.900,59;;"SIMEI";"INDUSTRIA DE ALIMENTOS";"RECIFE";"I";03/11/2015;"DIOGO FERNANDES MINERVINO DE SOUZA"
"064767671";"18464588000280";"ROSABA CONFECCAO E ARTIGOS PARA PRESENTES LTDA - ME";"S";5.381,27;659.018,70;;"SIMPLES NACIONAL";"TECIDOS";"RIBEIRAO";"I";27/10/2015;"RENILDO SANTOS DA ROCHA"
"064757285";"23534197000144";"DAYSE MARIA DE OLIVEIRA SILVA 71018760482";"A";27,33;91.152,25;;"SIMEI";"TECIDOS";"JABOATAO DOS GUARARAPES";"I";26/10/2015;
"064727882";"23516569000100";"LINDBERG CARLOS DE ALMEIDA NASCIMENTO 04457671460";"B";18,02;950.040,10;;"NORMAL";"VAREJO";"CARPINA";"I";26/10/2015;
"064674746";"23518742000109";"CLEYSON JOSE DOS SANTOS CONSERVACAO DOMICILIAR";"C";;14.546,00;7.438,80;"NORMAL";"ATACADO";"SAO JOSE DO EGITO";"II";22/10/2015;
"064673006";"19239020000229";"ISIS MARIA L. C. COSTA CONFECCOES INFANTIL ME";"B";46.964,28;1.674.768,33;;"NORMAL";"TECIDOS";"RECIFE";"I";22/10/2015;"CARLOS JOSE DA SILVA"
"064671640";"23513327000162";"MARIA DE FATIMA LOPES MOTA ME";"C";;27.414,67;80.808,10;"NORMAL";"TECIDOS";"RECIFE";"I";22/10/2015;
"064668428";"21948524000260";"BRUNO TELES DOS SANTOS-ME";"C";;7.575.689,97;289.730,00;"NORMAL";"ATACADO DE ALIMENTOS";"PETROLINA";"III";20/10/2015;"MARIA DE FATIMA BRANDAO DA SILVA"
"064623599";"21044511000185";"SEVERINO JOSE BEZERRA FILHO 76589960410";"C";;4.194,00;;"NORMAL";"TECIDOS";"RECIFE";"I";19/10/2015;
"064607208";"23455583000140";"JAIR MOTA DA SILVA 10812351444";"A";10,65;179.894,59;;"SIMEI";"INDUSTRIA DE ALIMENTOS";"BARREIROS";"I";19/10/2015;
"064595609";"23480805000185";"ERIVALDO OLIVEIRA DE ARAUJO EMBALAGENS EIRELI EPP";"C";;370.060,25;;"NORMAL";"ATACADO";"PESQUEIRA";"II";16/10/2015;
"064594807";"23477302000150";"PRO HIGIENE DO BRASIL LTDA";"B";;;;"NORMAL";"INDUSTRIA";"VITORIA DE SANTO ANTAO";"II";16/10/2015;"ISABELLA QUEIROZ GUIMARAES"
"064574601";"23444007000106";"KATIA MARIA RUSSELL DE PINHO ALVES 70992290449";"A";217,72;290.255,03;;"SIMEI";"TECIDOS";"RECIFE";"I";14/10/2015;
"064520005";"23424946000180";"ZELIA ALVES DA SILVA 85628905453";"A";24,57;347.327,88;;"SIMEI";"VAREJO";"RECIFE";"I";14/10/2015;
"064496201";"23436329000103";"CARLA MICHELE SOUZA SILVA GOMES ME";"S";1.150,15;78.032,55;;"SIMPLES NACIONAL";"VAREJO";"OURICURI";"III";08/10/2015;"JAILSON BEZERRA GOMES"
"064493954";"23431721000151";"AROEIRA COMERCIO E REPRESENTACOES EIRELI EPP";"B";597,47;14.335.619,96;7.190.126,59;"NORMAL";"BEBIDAS";"OLINDA";"I";08/10/2015;
"064397483";"23410341000130";"ALEXSANDRO SILVA CABOCLO";"C";540,54;3.516.390,39;1.943.424,75;"NORMAL";"ATACADO";"GRAVATA";"II";05/10/2015;"AMYLSON JOSE FERREIRA MENDES"
"064358232";"23346394000130";"CLAUDIO HENRIQUE BARBOSA 06251873426";"A";28,01;92.501,31;;"SIMEI";"TELECOMUNICACAO";"CAMARAGIBE";"I";28/09/2015;
"064297004";"23332148000129";"ARTUR FERREIRA DA CRUZ MERCADINHO ME";"B";;876.464,58;;"NORMAL";"SUPERMERCADOS";"RECIFE";"I";28/09/2015;
"064296296";"23331625000131";"ANABELLA ACESSORIOS INFANTIS LTDA ME";"A";1.498,94;78.147,83;242.695,58;"SIMPLES NACIONAL";"TECIDOS";"CARUARU";"II";28/09/2015;"JONAS EMANUEL SENA DA SILVA"
"064289168";"23339742000141";"JOAB URBANO PEREIRA EMBALAGENS EIRELI EPP";"C";;2.176.157,17;;"NORMAL";"VAREJO";"BEZERROS";"II";24/09/2015;
"064218490";"23275144000156";"ERLY LINS ROCHA MARQUES 03897910403";"A";836,26;796.330,36;;"SIMEI";"VAREJO";"RECIFE";"I";21/09/2015;"JOSE DE ARIMATEA DE MESQUITA E SILVA"
"064191869";"19559963000239";"L K A RIBEIRO COMERCIO ME";"S";964,20;70.068,40;1,00;"NORMAL";"TECIDOS";"PETROLINA";"III";18/09/2015;"ROSIMERE MARIA DE FRANCA FERREIRA"
"064146480";"23245198000179";"ERINALDO CANDIDO FERREIRA 82319472487";"A";4.629,28;163.888,47;;"SIMEI";"MATERIAL DE CONSTRUCAO";"RECIFE";"I";15/09/2015;
"064067696";"23198022000103";"MAYARA PEREIRA DE AQUINO 07038929402";"A";4.571,60;214.339,76;;"SIMEI";"TECIDOS";"EXU";"III";08/09/2015;"ANA ELMA DE ALENCAR PAGEU"
"064032981";"23224102000196";"WILLIAN DE MELO LOPES 08683835464";"B";;313.889,59;;"NORMAL";"VAREJO";"JABOATAO DOS GUARARAPES";"I";08/09/2015;"ELAINE JOSE DO NASCIMENTO"
"064018806";"23215491000193";"MARCIO CORDEIRO DA SILVA 64088650204";"A";103,18;249.230,79;;"SIMEI";"VAREJO";"AFOGADOS DA INGAZEIRA";"II";08/09/2015;"GIZELLE GALDINO BRANDAO"
"063998602";"23201868000155";"COMERCIAL VITORIA COMERCIO DE TECIDOS EIRELI";"A";155.191,57;8.156.398,33;2.160.656,03;"NORMAL";"TECIDOS";"SANTA CRUZ DO CAPIBARIBE";"II";03/09/2015;"ERICKSON RODRIGUES DE ANDRADE"
"063976110";"23167250000116";"MARCIO PEREIRA DE OLIVEIRA 07941054400";"A";28,00;451.275,46;;"SIMEI";"BEBIDAS";"RECIFE";"I";01/09/2015;
"063955385";"23156638000111";"IRAILSON BARROS FERNANDES 01091677409";"A";846,94;90.301,60;;"SIMEI";"INDUSTRIA";"CARUARU";"II";01/09/2015;"ANA VALERIA SANTOS DE SOUZA SILVA"
"063955032";"23156352000136";"DJANCA DE ANDRADE SANTIAGO 02961761336";"A";;437.203,43;;"SIMEI";"VAREJO";"TAMANDARE";"I";01/09/2015;
"063943450";"23150009000184";"JUSSARA PAIVA AMORIM 44259565400";"A";19,97;186.825,60;8.332,80;"SIMEI";"TECIDOS";"RECIFE";"I";01/09/2015;
